"","hospital","address","bed_class1","last_update_class1","bed_class2","last_update_class2","bed_class3","last_update_class3","tlp_number","province","district","scraped_at","bed_type"
"306","RS Umum Daerah Pasar Minggu","JL. TB. SIMATUPANG NO. 1 KELURAHAN RAGUNAN, KECAMATAN PASAR MINGGU - JAKARTA SELATAN",19,NA,7,NA,23,NA,"087826861686","31","3171",2021-08-08 18:42:33,"Non COVID-19"
"307","RS Ketergantungan Obat","Jl. Lapangan Tembak No 75 
Kelurahan Cibubur 
Kecamatan  Ciracas 
Jakarta Timur 13720",4,"2 menit",3,"2 menit",9,"2 menit","02187711969","31","3172",2021-08-08 18:42:33,"Non COVID-19"
"308","RS Umum Harum","Jl. Tarum Barat, Kalimalang",9,"11 jam",14,"11 jam",23,"11 jam","0218617212","31","3172",2021-08-08 18:42:33,"Non COVID-19"
"309","RS Umum Harapan Bunda","Jl. Raya Bogor Km.22 No.44 Jaktim",9,"12 jam",15,"12 jam",27,"11 jam","0218400257","31","3172",2021-08-08 18:42:33,"Non COVID-19"
"310","RS Umum Yadika","Jl. Pahlawan Revolusi No.47 Pondok Bambu Jaktim",2,NA,11,NA,9,NA,"0218615754","31","3172",2021-08-08 18:42:33,"Non COVID-19"
"311","RSK Pusat Otak Nasional","Jl MT Haryono Kav 11, Kelurahan Cawang, Kecamatan Kramat Jati, Jakarta Timur",6,NA,4,NA,16,NA,"02122040055","31","3172",2021-08-08 18:42:33,"Non COVID-19"
"312","RS Umum Daerah Cipayung","Jl. Mini III RT 04 RW 03 Bambu Apus Cipayung",NA,NA,NA,NA,28,"kurang dari 1 menit","02185506222","31","3172",2021-08-08 18:42:33,"Non COVID-19"
"313","RS Umum Mulyasari","Jl. Raya Plumpung Semper No.19 RT.006/RW.015, Jakarta Utara ",14,"24 menit",22,"24 menit",26,"24 menit","02143931111","31","3175",2021-08-08 18:42:34,"Non COVID-19"
"314","RS Umum Royal Progress","Jl. Danau Sunter Utara, Sunter Paradise I",8,NA,24,NA,13,NA,"081906511008","31","3175",2021-08-08 18:42:34,"Non COVID-19"
"315","RS Umum Daerah  Tanjung Priok","Jl. Bugis No. 03 Kel. Kebon Bawang Kec. Tanjung Priok",NA,NA,NA,NA,8,NA,"02143908923","31","3175",2021-08-08 18:42:34,"Non COVID-19"
"316","RS Royal Prima","Jl. Raden Wijaya RT 35 Kebon Kopi Kec Jambi Selatan",10,"9 jam",15,"9 jam",44,"9 jam","074141010","15","1571",2021-08-08 18:42:34,"Non COVID-19"
"317","RS Tk. IV dr. Bratanata","Jl. Raden Mattaher No. 33,Jambi",15,"34 jam",12,"34 jam",17,"34 jam","074134212","15","1571",2021-08-08 18:42:34,"Non COVID-19"
"318","RS Bhayangkara Jambi","Jl. Raden Mathaher No.03 Jambi",19,NA,6,NA,16,"36 jam","074134409","15","1571",2021-08-08 18:42:34,"Non COVID-19"
"319","RS Umum Santa Theresia","Jl. Dr. Sutomo No.19 Jambi",7,"11 jam",8,"11 jam",9,"11 jam","074123119","15","1571",2021-08-08 18:42:34,"Non COVID-19"
"320","RS Umum Daerah H. Abdul Manap","Jl. SK.Rd.Syahbuddin Kel. Mayang Mangurai Kec.Kota Baru Jambi",24,"17 jam",39,"17 jam",84,"17 jam","07415910180","15","1571",2021-08-08 18:42:34,"Non COVID-19"
"321","RS Umum Kambang","Jl. Kol. Amir Hamzah No. 35 Sei Kambang Jambi",4,"10 jam",21,"10 jam",8,NA,"074161714","15","1571",2021-08-08 18:42:34,"Non COVID-19"
"322","RS Umum Baiturahim Jambi","Jl. Prof. M. Yamin SH, No. 30 Kel. Lebak Bandung",12,"13 jam",8,"13 jam",18,"13 jam","074135165","15","1571",2021-08-08 18:42:34,"Non COVID-19"
"323","RS Umum Rimbo Medika","Jl, Kap. Pattimura RT. 02 No. 58 Jambi kelurahan kenali besar,kec alam barajo",2,"31 jam",2,"31 jam",3,"31 jam","0741582030","15","1571",2021-08-08 18:42:34,"Non COVID-19"
"324","RS Umum Daerah H. Abdurrahman Sayoeti","Jl. KH. Hasan Anang No. 33 Kel. Olak Kemang Kec. Danau Teluk Kota Jambi",NA,NA,NA,NA,9,"10 jam","081214965245","15","1571",2021-08-08 18:42:34,"Non COVID-19"
"325","RS TK. IV 05.07.02 Kediri","Jl. Mayjen Sungkono No. 44, Kota Kediri",6,"8 jam",7,"8 jam",24,"8 jam","0354687801","35","3571",2021-08-08 18:42:35,"Non COVID-19"
"326","RS Umum Ratih","Jl. Penanggungan No.32, Kota Kediri",7,NA,13,NA,44,NA,"0354779500","35","3571",2021-08-08 18:42:35,"Non COVID-19"
"327","RS Umum Aliyah II","Jl. Buburanda Korumba - Mandonga Kendari Sulawesi Tenggara",0,"9 jam",2,"9 jam",16,"9 jam","082116987801","74","7471",2021-08-08 18:42:36,"Non COVID-19"
"328","RS TNI AL Lantamal VII Kupang","Jl. Yos Sudarso No. 5 Osmok, Kel Namosain Kec.Alak, Kupang",21,"11 jam",NA,NA,NA,NA,"082236733397","53","5371",2021-08-08 18:42:36,"Non COVID-19"
"329","RS Kartini","Jl. Frans Seda No. 17",3,"9 jam",7,"9 jam",9,"9 jam","0380831270","53","5371",2021-08-08 18:42:36,"Non COVID-19"
"330","RS Umum Daerah Langsa","Jl. Ahmad Yani No.1  Kec. Langsa Kota",15,"6 menit",80,"6 menit",87,"6 menit","064122800","11","1173",2021-08-08 18:42:36,"Non COVID-19"
"331","RS Tk. IV Lhokseumawe Aceh Utara","Jl. Samudra No.53A Kp Jawa Kec. Banda Sakti Lhokseumawe AUT",1,"9 jam",6,"9 jam",11,"9 jam","082275830041","11","1174",2021-08-08 18:42:36,"Non COVID-19"
"332","RS Ibu dan Anak Dwi Sari","Jl. Yos Sudarso No. 2 ",1,NA,1,NA,2,NA,"081272068450","16","1674",2021-08-08 18:42:36,"Non COVID-19"
"333","RS Umum Daerah Dr. Soedono Madiun","Jl. Dr. Soetomo 59, Madiun",9,"32 menit",6,"32 menit",55,"32 menit","082139645425","35","3577",2021-08-08 18:42:37,"Non COVID-19"
"334","RS Umum Daerah Tidar","Jl. Tidar No.30 A, Kota Magelang",6,NA,79,NA,59,"4 jam","0293362260","33","3371",2021-08-08 18:42:37,"Non COVID-19"
"335","RS Jiwa Prof. Dr. Soerojo"," Jl. Jenderal Ahmad Yani 169 Magelang",21,"2 menit",14,"2 menit",50,"2 menit","0293363601","33","3371",2021-08-08 18:42:37,"Non COVID-19"
"336","RS Umum Lestari Raharja","Jl. Sutopo No.5,Magelang",6,"40 menit",3,"40 menit",NA,NA,"0293363223","33","3371",2021-08-08 18:42:37,"Non COVID-19"
"337","RS Umum Daerah Labuang Baji","Jl. Dr. Ratulangi No. 81 Makassar",35,NA,43,NA,66,NA,"081355538118","73","7371",2021-08-08 18:42:37,"Non COVID-19"
"338","RS Akademis Jaury","Jl. Jend. M. Jusuf No. 57 Makassar",34,"32 jam",25,"32 jam",31,"32 jam","04113617343","73","7371",2021-08-08 18:42:37,"Non COVID-19"
"339","RS Stella Maris","Jl. Somba Opu No.273 Makassar",32,NA,9,NA,50,"1 menit","081340604910","73","7371",2021-08-08 18:42:37,"Non COVID-19"
"340","RS Ibu dan Anak Sentosa","Jl. Jend Sudirman No.52 Makkassar",9,"35 jam",NA,NA,11,"35 jam","081340189496","73","7371",2021-08-08 18:42:37,"Non COVID-19"
"341","RS Khusus Daerah Ibu dan Anak Siti Fatimah"," Jl. Gunung Merapi No. 73 Makassar",6,NA,16,NA,24,NA,"hotline tidak tersedia","73","7371",2021-08-08 18:42:37,"Non COVID-19"
"342","RS Dr. Tadjuddin Chalid, MPH","Jl. Paccerakkang No.67 / Pajjaiang Daya Makassar",31,"1 menit",14,"1 menit",33,"1 menit","081144404545","73","7371",2021-08-08 18:42:37,"Non COVID-19"
"343","RSUP Dr. Wahidin Sudirohusodo","      Jl. Perintis Kemerdekaan Km.11 Makasar",49,"2 menit",112,"kurang dari 1 menit",161,"kurang dari 1 menit","0411584675","73","7371",2021-08-08 18:42:37,"Non COVID-19"
"344","RS Grestelina","Jl. Hertasning Raya No.52 Makassar",21,"12 jam",21,"12 jam",35,"12 jam","hotline tidak tersedia","73","7371",2021-08-08 18:42:37,"Non COVID-19"
"345","RS Universitas Hasanuddin","Jl. Perintis Kemerdekaan KM 11 Tamalanrea",24,NA,16,NA,54,NA,"0411591331","73","7371",2021-08-08 18:42:37,"Non COVID-19"
"346","RS Umum Panti Waluya Sawahan Malang","Jl. Nusakambangan No.56 Kota Malang",27,"11 jam",28,"11 jam",18,"11 jam","0341366033","35","3573",2021-08-08 18:42:38,"Non COVID-19"
"347","RS Ibu dan Anak Muhammadiyah Malang","Jl. KH. Wahid Hasyim NO. 30 Malang",2,NA,5,NA,5,NA,"0341326222","35","3573",2021-08-08 18:42:38,"Non COVID-19"
"348","RS Islam Malang","Jl. MT. Haryono No. 139 Malang",8,"2 jam",15,"2 jam",20,"2 jam","0341570400","35","3573",2021-08-08 18:42:38,"Non COVID-19"
"349","RS Umum Permata Bunda","Jl. Soekarno Hatta No. 75 Malang",NA,NA,7,"34 jam",20,"41 jam","0341407462","35","3573",2021-08-08 18:42:38,"Non COVID-19"
"350","RSUP Prof. Dr. R. D. Kandou","Jl. Raya Tanawangko No.56, Manado",68,"2 menit",141,"2 menit",167,"2 menit","082196305119","71","7171",2021-08-08 18:42:38,"Non COVID-19"
"351","RS Jiwa Mutiara Sukma","  Jl. A Yani no. 1 Selagalas Cakranegara, Mataram",3,NA,4,"12 jam",40,"12 jam","hotline tidak tersedia","52","5271",2021-08-08 18:42:38,"Non COVID-19"
"352","RS Umum Daerah Dr. Pirngadi","Jl Prof H M Yamin SH No. 47, Medan",37,NA,52,NA,120,NA,"hotline tidak tersedia","12","1275",2021-08-08 18:42:39,"Non COVID-19"
"353","RS Umum Delima Medan","Jl Kl. Yos Sudarso Km.13,6 No.19 A, Medan - Martubung",0,NA,17,NA,20,NA,"hotline tidak tersedia","12","1275",2021-08-08 18:42:39,"Non COVID-19"
"354","RS Jiwa Prof. Dr. Muhammad Ildrem","Jl Let. Jend. Jamin Ginting S Km. 10/ Jl. Tali Air No. 21 Kel. Mangga Kec. Medan Tuntungan",13,"kurang dari 1 menit",34,"kurang dari 1 menit",141,"kurang dari 1 menit","hotline tidak tersedia","12","1275",2021-08-08 18:42:39,"Non COVID-19"
"355","RS Umum Siti Hajar","Jl Letjend Jamin Ginting No.2, Medan",2,NA,10,NA,18,NA,"082217401119","12","1275",2021-08-08 18:42:39,"Non COVID-19"
"356","RSUP H. Adam Malik","Jl Bunga Lau No. 17, Medan",50,"2 menit",21,"2 menit",85,"2 menit","0618363000","12","1275",2021-08-08 18:42:39,"Non COVID-19"
"357","RS Ibu dan Anak Badrul Aini","Jl Bromo Gg.Sukri No.18 Medan",7,NA,4,NA,13,NA,"hotline tidak tersedia","12","1275",2021-08-08 18:42:39,"Non COVID-19"
"358","RS Umum Estomihi","Jl. Sisinga Mangaraja 235,Medan",10,NA,7,NA,22,NA,"082165452466","12","1275",2021-08-08 18:42:39,"Non COVID-19"
"359","RS Umum Royal Prima","Jl Ayahanda No 68A Medan",27,NA,0,NA,48,NA,"085261625430","12","1275",2021-08-08 18:42:39,"Non COVID-19"
"360","RS Umum Royal Prima Marelan","Jl. Marelan Pasar 3 No. 187 Kel. Rengas Pulau Kec. Medan Marelan 20255 Sumut",0,"32 jam",NA,NA,25,"32 jam","085260844632","12","1275",2021-08-08 18:42:39,"Non COVID-19"
"361","RS Umum Sufina Azis","Jl Karya Baru No.1,Medan",8,"16 menit",11,"16 menit",27,"16 menit","081376497039","12","1275",2021-08-08 18:42:39,"Non COVID-19"
"362","RS Umum Bina Kasih","Jl Jend. TB.Simatupang No.148 Sunggal ",47,"34 jam",65,"34 jam",74,"34 jam","0618445271","12","1275",2021-08-08 18:42:39,"Non COVID-19"
"363","RS Reksa Waluya","Jl. Mojopahit 422, Kel. Miji, Kec. Prajurit Kulon, Kota Mojokerto",13,"34 jam",1,"34 jam",5,"34 jam","0321322170","35","3576",2021-08-08 18:42:39,"Non COVID-19"
"364","RS Islam Hasanah Muhammadiyah ","Jl. HOS Cokroaminoto No. 26-28, Kel. Jagalan, Kec. Magersari, Kota Mojokerto",3,"34 jam",10,"34 jam",18,"34 jam","0321321635","35","3576",2021-08-08 18:42:39,"Non COVID-19"
"365","RS Kamar Medika","Jl. Empunala No.351, Kel. Kedundung, Kec. Magersari, Kota Mojokerto",2,"40 menit",7,"40 menit",17,"40 menit","0321330066","35","3576",2021-08-08 18:42:39,"Non COVID-19"
"366","RSUP Dr. M. Djamil","Jl. Perintis Kemerdekaan Padang",21,NA,72,NA,135,NA,"082175066250","13","1371",2021-08-08 18:42:39,"Non COVID-19"
"367","RS Bhayangkara Padang","Jl. Jati No.I Padang",NA,NA,0,"6 menit",4,"6 menit","082387422450","13","1371",2021-08-08 18:42:39,"Non COVID-19"
"368","RS Umum Daerah Padang Panjang","Jl. Tabek Gadang Kelurahan Ganting Kec.Padang Panjang Timur Kota Padang Panjang",8,"kurang dari 1 menit",9,"kurang dari 1 menit",22,"kurang dari 1 menit","08116667118","13","1374",2021-08-08 18:42:40,"Non COVID-19"
"369","RS Umum Ibnu Sina Padang Panjang","Jl. Sukarno. Hatta,Padang Panjang",1,"42 menit",8,"42 menit",9,"42 menit","085274551137","13","1374",2021-08-08 18:42:40,"Non COVID-19"
"370","RS Bhayangkara Palangka Raya","Jl. Ahmad Yani No. 22",4,NA,3,NA,NA,NA,"05363221520","62","6271",2021-08-08 18:42:41,"Non COVID-19"
"371","RS Umum Pusat Dr. Mohammad Hoesin Palembang","Jl. Jendral Sudirman KM 3,5 Palembang",47,"7 jam",47,"7 jam",155,"7 jam","0711354088","16","1671",2021-08-08 18:42:41,"Non COVID-19"
"372","RS Umum Pertamina Palembang","Komplek Pertamina Plaju, Palembang",12,NA,7,NA,7,NA,"0711597444","16","1671",2021-08-08 18:42:41,"Non COVID-19"
"373","RS Umum Charitas Hospital Palembang","Jl. Sudirman 1054 Palembang",17,"9 jam",25,"9 jam",34,"9 jam","082177013867","16","1671",2021-08-08 18:42:41,"Non COVID-19"
"374","RS Jiwa Ernaldi Bahar Provinsi Sumatera Selatan","Jl. Tembus Terminal No. 02, KM. 12 Kecamatan Alang Alang Lebar Kota Palembang",21,NA,17,NA,85,NA,"07115645123","16","1671",2021-08-08 18:42:41,"Non COVID-19"
"375","RS Islam Siti Khadijah","Jl. Demang Lebar Daun No.26",0,NA,17,NA,8,NA,"0711536008","16","1671",2021-08-08 18:42:41,"Non COVID-19"
"376","RS Muhammadiyah Palembang","Jl. A. Yani 13 Ulu, Palembang",12,"40 menit",9,"40 menit",55,"40 menit","0711511446","16","1671",2021-08-08 18:42:41,"Non COVID-19"
"377","RS Khusus Paru Palembang","Jl. Merdeka No.10,Palembang",2,"14 jam",6,"14 jam",14,"14 jam","0711352010","16","1671",2021-08-08 18:42:41,"Non COVID-19"
"378","RS Ibu dan Anak Az-Zahra Palembang","Jl.Brigjend Hasan Kasim No. 1-2 Kel. Bukit Sangkal Kec. Kalidoni Palembang",NA,NA,10,NA,9,NA,"0711822723","16","1671",2021-08-08 18:42:41,"Non COVID-19"
"379","RS Umum Daerah Siti Fatimah Provinsi Sumatera Sela","Jl. Kol. H. Burlian Km 6 ",NA,NA,NA,NA,NA,NA,"07115718889","16","1671",2021-08-08 18:42:41,"Non COVID-19"
"380","RS Umum Daerah Gandus Palembang","Jl. Sofyan Kenawas Gandus Palembang",NA,NA,NA,NA,32,"12 jam","081377666447","16","1671",2021-08-08 18:42:41,"Non COVID-19"
"381","RS Umum Bintang Laut Palopo","Jl. KH. M. Kasim No. 5 Palopo",4,NA,21,NA,25,NA,"085225356180","73","7373",2021-08-08 18:42:41,"Non COVID-19"
"382","RS Umum St. Madyang","JL. Andi Kambo NO.87 ",15,"kurang dari 1 menit",13,"kurang dari 1 menit",30,"kurang dari 1 menit","hotline tidak tersedia","73","7373",2021-08-08 18:42:41,"Non COVID-19"
"383","RS Umum Daerah Sawerigading","   Jl. Dr. Ratulangi KM.7 Rampoang Kota Palopo",33,"2 jam",38,"2 jam",61,"2 jam","04173312133","73","7373",2021-08-08 18:42:41,"Non COVID-19"
"384","RS Umum Anutapura Palu","Jl. Kangkung No. 1 Palu",20,"34 jam",21,"34 jam",65,"34 jam","085242816072","72","7271",2021-08-08 18:42:41,"Non COVID-19"
"385","RS Umum Daerah Madani Palu","Jl. Thalua Kontji No. 11  Mamboro Palu",NA,NA,NA,NA,NA,NA,"081145600615","72","7271",2021-08-08 18:42:41,"Non COVID-19"
"386","RS Umum Daerah Andi Makkasau Parepare","    Jl. Nurussamawati No.9 Kota Parepare",19,"33 jam",19,"33 jam",39,"33 jam","hotline tidak tersedia","73","7372",2021-08-08 18:42:42,"Non COVID-19"
"387","RS Umum Ibnu Sina Kota Payakumbuh","Jl.Pemuda No 14 Payakumbuh",14,"1 jam",20,"1 jam",18,"1 jam","075292222","13","1376",2021-08-08 18:42:42,"Non COVID-19"
"388","RS Umum Daerah Dr. Adnaan WD","Jl. AIS Nasution 25,Balai Kaliki Payakumbuh",17,"14 jam",23,"14 jam",31,"14 jam","082388321233","13","1376",2021-08-08 18:42:42,"Non COVID-19"
"389","RS Umum Karomah Holistic","Jl. Gajah Mada Barat No.124,Pekalongan",6,"42 menit",13,"42 menit",15,"42 menit","0285420218","33","3375",2021-08-08 18:42:42,"Non COVID-19"
"390","RS Tk. IV Pekanbaru","Jl Kesehatan No 2 Pekanbaru",3,"15 jam",11,NA,12,"15 jam","hotline tidak tersedia","14","1471",2021-08-08 18:42:43,"Non COVID-19"
"391","RS Prof. Dr. Tabrani","Jl Jend. Sudirman 410, Pekanbaru",16,"10 jam",14,"10 jam",15,"10 jam","085374419082","14","1471",2021-08-08 18:42:43,"Non COVID-19"
"392","RS Umum  Awal Bros Pekanbaru","Jl Sudirman No.117 Pekanbaru",3,"18 jam",3,"18 jam",4,"18 jam","08117079090","14","1471",2021-08-08 18:42:43,"Non COVID-19"
"393","RS Awal Bros A. Yani","Jl A. Yani No. 73",6,"15 jam",25,"15 jam",11,"15 jam","076121000","14","1471",2021-08-08 18:42:43,"Non COVID-19"
"394","RS Ibu dan Anak  Annisa","Jl Garuda No.66 Kel.Tangkerang Tengah Kec.Marpoyan Damai",7,"34 jam",1,"34 jam",2,"34 jam","085264596519","14","1471",2021-08-08 18:42:43,"Non COVID-19"
"395","RS Umum  Awal Bros Panam","Jl HR. Soebrantas No 88 Panam",3,"34 jam",6,"34 jam",12,"34 jam","0761586888","14","1471",2021-08-08 18:42:43,"Non COVID-19"
"396","RS Umum  Aulia Hospital","Jl HR Soebrantas No 63",11,"34 menit",41,"34 menit",38,"34 menit","07616700000","14","1471",2021-08-08 18:42:43,"Non COVID-19"
"397","RS Umum Harapan","Jl Farel Pasaribu No. 21",18,NA,17,NA,34,NA,"hotline tidak tersedia","12","1273",2021-08-08 18:42:43,"Non COVID-19"
"398","RS Umum Vita Insani","Jl. Merdeka No.329, Pematang Siantar",22,NA,27,NA,63,"kurang dari 1 menit","062222520","12","1273",2021-08-08 18:42:43,"Non COVID-19"
"399","RS Umum Tiara Kasih Sejati","Jl Menambin No.4, Timbang Galung, Pematangsiantar",26,NA,20,NA,30,NA,"081370989113","12","1273",2021-08-08 18:42:43,"Non COVID-19"
"400","RS Umum Daerah Dr. Soedarso Pontianak","Jl. dr. Soedarso No.1 Pontianak",10,"2 jam",15,NA,130,"2 jam","0561737701","61","6171",2021-08-08 18:42:43,"Non COVID-19"
"401","RS Pertamina Kota Prabumulih","Jl. Kesehatan No.100,Prabumulih",15,"8 jam",15,"8 jam",43,"8 jam","0713382742","16","1672",2021-08-08 18:42:44,"Non COVID-19"
"402","RS AR Bunda Kota Prabumulih","Jl. Angkatan 45 Kel.Prabumulih Timur",12,"30 jam",14,"30 jam",47,"42 jam","08127166809","16","1672",2021-08-08 18:42:44,"Non COVID-19"
"403","RS Umum Daerah dr. Mohamad Saleh Kota Probolinggo","  Jl. Mayjend Panjaitan No.65 Kota Probolinggo",12,"kurang dari 1 menit",11,"kurang dari 1 menit",23,"kurang dari 1 menit","085231229303","35","3574",2021-08-08 18:42:44,"Non COVID-19"
"404","RS Ibu dan Anak Amanah","Jln dr Moh. Saleh No. 43 Kota Probolinggo",6,NA,11,NA,3,NA,"0335423487","35","3574",2021-08-08 18:42:44,"Non COVID-19"
"405","RS Umum Daerah Salatiga"," Jl. Osamaliki No.19,Salatiga",18,"35 jam",41,"35 jam",60,"35 jam","0298324074","33","3373",2021-08-08 18:42:44,"Non COVID-19"
"406","RS Paru Dr. Ario Wirawan","      Jl. Hasanudin No.806,Salatiga",NA,NA,NA,NA,NA,NA,"0298313514","33","3373",2021-08-08 18:42:44,"Non COVID-19"
"407","RS Ibu dan Anak Hermina Mutiara Bunda","jl. Merak no.8",2,NA,3,NA,3,"10 jam","0298328873","33","3373",2021-08-08 18:42:44,"Non COVID-19"
"408","RS Umum Dirgahayu","Jl. Gn. Merbabu No.62 Samarinda",19,NA,40,NA,21,NA,"0541742161","64","6472",2021-08-08 18:42:44,"Non COVID-19"
"409","RS Jiwa Atma Husada Mahakam","Jl. Kakap No.23 Samarinda",4,"2 menit",15,"2 menit",28,"2 menit","0541743364","64","6472",2021-08-08 18:42:44,"Non COVID-19"
"410","RS Umum Daerah Inche Abdoel Moeis","Jl. H.A.M.M Rifaddin, Kel. Harapan Baru, Kec. Loa Janan Ilir, Samarinda ",0,"13 menit",7,"13 menit",20,"13 menit","05417269005","64","6472",2021-08-08 18:42:44,"Non COVID-19"
"411","RS Ibu dan Anak Plamongan Indah","jl. kelapa gading raya no. 52 semarang",4,"35 jam",8,"35 jam",10,"35 jam","0246711771","33","3374",2021-08-08 18:42:45,"Non COVID-19"
"412","RS Umum Pusat Dr. Kariadi","Jl. Dr. Soetomo No.16,Semarang",47,"5 menit",50,"5 menit",89,"5 menit","0248414281","33","3374",2021-08-08 18:42:45,"Non COVID-19"
"413","RS Umum St. Elisabeth Semarang","Jl. Kawi No.1,Semarang",2,NA,19,NA,19,NA,"0248310076","33","3374",2021-08-08 18:42:45,"Non COVID-19"
"414","RS Umum Telogorejo Semarang","Jl. KH. Ahmad Dahlan Semarang",0,"15 jam",0,"15 jam",0,"15 jam","02486466000","33","3374",2021-08-08 18:42:45,"Non COVID-19"
"415","RS Umum Roemani Muhammadiyah","Jl. Wonodri No. 22,Semarang",15,NA,33,NA,27,NA,"0248444623","33","3374",2021-08-08 18:42:45,"Non COVID-19"
"416","RS Umum Panti Wilasa Citarum","Jl. Citarum No 98 Semarang",14,"3 menit",26,"3 menit",16,"3 menit","024-3542224","33","3374",2021-08-08 18:42:45,"Non COVID-19"
"417","RS Jiwa Daerah  Dr. Amino Gondohutomo","Jl. Brigjen Sudiarto No. 347, Pedurungan, Kota Semarang",8,"8 menit",11,"8 menit",26,"8 menit","0246722565","33","3374",2021-08-08 18:42:45,"Non COVID-19"
"418","RS Panti Wilasa ","Jl. Dr. Cipto 50, Bugangan, Semarang Timur",2,"4 menit",22,"4 menit",5,"4 menit","08156696040","33","3374",2021-08-08 18:42:45,"Non COVID-19"
"419","RS Ibu dan Anak Bunda Semarang","Jl. Brigjen Katamso No. 8",3,NA,1,"35 jam",6,"35 jam","081575008811","33","3374",2021-08-08 18:42:45,"Non COVID-19"
"420","RS Umum Banyumanik","Jl. Bina Remaja Srondol No.61,Semarang",2,"12 jam",4,"12 jam",5,"12 jam","0247471519","33","3374",2021-08-08 18:42:45,"Non COVID-19"
"421","RS Umum Daerah KRMT Wongsonegoro","  Jl. Fatmawati Raya No.1",7,"kurang dari 1 menit",7,"kurang dari 1 menit",42,"kurang dari 1 menit","1500219","33","3374",2021-08-08 18:42:45,"Non COVID-19"
"422","Siloam Hospitals Semarang","Jl. Kompol Maksum No. 296 
Peterongan",4,NA,2,NA,1,NA,"02486001900","33","3374",2021-08-08 18:42:45,"Non COVID-19"
"423","RS Umum Daerah Kota Subulussalam","  Jl. Hamzah Fansyuri (Subulussalam-Rundeng) Kec. Simpang Kiri Kota Subulussalam Aceh 24782",0,NA,7,NA,32,NA,"085260077824","11","1175",2021-08-08 18:42:46,"Non COVID-19"
"424","RS Umum Daerah R. Syamsudin, SH","Jl. Rumah Sakit No. 1 Kota Sukabumi",14,NA,20,"33 jam",64,"32 jam","0266225180","32","3272",2021-08-08 18:42:46,"Non COVID-19"
"425","RS Umum Bhayangkara Setukpa Lemdikpol","Jl. Aminta Azmali No. 59A Kota Sukabumi",NA,NA,NA,NA,NA,NA,"08568734424","32","3272",2021-08-08 18:42:46,"Non COVID-19"
"426","RS Umum Kartika Kasih"," Jl. Jenderal Ahmad Yani No.18A, Kota Sukabumi",20,NA,19,"10 jam",6,"10 jam","02666250905","32","3272",2021-08-08 18:42:46,"Non COVID-19"
"427","RS Umum Melati","Jl. Ahmad Yani No. 36 Kel/Kec. Sungai Penuh",5,"35 jam",4,"35 jam",10,"35 jam","074821145","15","1572",2021-08-08 18:42:46,"Non COVID-19"
"428","RS Primasatya Husada Citra (PHC) Surabaya","Jl. Prapat Kurung Selatan no 1 Tanjung Perak Surabaya",7,NA,13,NA,0,NA,"0313294118","35","3578",2021-08-08 18:42:47,"Non COVID-19"
"429","RS Mata Undaan","Jl. Undaan Kulon 17-19 Surabaya",NA,NA,NA,NA,5,NA,"0315343806","35","3578",2021-08-08 18:42:47,"Non COVID-19"
"430","RS Muji Rahayu","JL.RAYA MANUKAN WETAN 68-68 A Surabaya",9,NA,9,NA,16,"34 jam","0317404132","35","3578",2021-08-08 18:42:47,"Non COVID-19"
"431","RS Umum Haji Surabaya"," Jl. Manyar Kertoadi  Surabaya",7,NA,26,NA,30,NA,"0315924000","35","3578",2021-08-08 18:42:47,"Non COVID-19"
"432","RS Umum Daerah dr. Mohamad Soewandhie","Jl. Tambakrejo No. 45-47 Surabaya",6,"15 jam",11,"15 jam",26,"15 jam","0313717141","35","3578",2021-08-08 18:42:47,"Non COVID-19"
"433","RS Ibu dan Anak Pura Raharja","Jl. Pucang Adi No.12 - 14 Surabaya",3,"8 jam",14,"8 jam",3,"8 jam","0315019898","35","3578",2021-08-08 18:42:47,"Non COVID-19"
"434","RS Mata Masyarakat Jawa Timur"," JL. Gayung Kebonsari Timur No 49 Surabaya",3,"35 jam",6,"34 jam",19,"34 jam","03182010000","35","3578",2021-08-08 18:42:47,"Non COVID-19"
"435","RS Umum Daerah Dr. Moewardi Surakarta","  Jl. Kol Sutarto 132,Surakarta",41,NA,44,NA,99,NA,"0271642642","33","3372",2021-08-08 18:42:47,"Non COVID-19"
"436","RS Umum Tk IV Slamet Riyadi Surakarta","  Jl. Slamet Riyadi 321,Surakarta",4,NA,6,NA,0,NA,"0271714656","33","3372",2021-08-08 18:42:47,"Non COVID-19"
"437","RS Umum Panti Waluyo","Jl. Jend A Yani No.1",3,"42 menit",4,"42 menit",21,"42 menit","0271712077","33","3372",2021-08-08 18:42:47,"Non COVID-19"
"438","RS Umum PKU Muhammadiyah Surakarta","Jl. Ronggowarsito 130, Surakarta",30,NA,15,NA,25,NA,"0271714578","33","3372",2021-08-08 18:42:47,"Non COVID-19"
"439","RS Umum Islam Kustati","Jl. Kapt. Mulyadi No.249",12,NA,29,NA,38,NA,"0271643013","33","3372",2021-08-08 18:42:47,"Non COVID-19"
"440","RS Umum Kasih Ibu","Jl. Slamet Riyadi 404,Surakarta",1,NA,0,NA,6,NA,"0271714422","33","3372",2021-08-08 18:42:47,"Non COVID-19"
"441","RS Umum Daerah Kota Surakarta","  Jln. Lettu Sumarto No. 1 Kelurahan Kadipiro, Kecamatan Banjarsari, Kota Surakarta",3,"19 jam",10,"19 jam",18,"19 jam","0271715700","33","3372",2021-08-08 18:42:47,"Non COVID-19"
"442","RS Onkologi Solo","Jl. Siwalan No.37 RT.002 RW.014 Kerten, Laweyan Surakarta",NA,NA,NA,NA,NA,NA,"02717651717","33","3372",2021-08-08 18:42:47,"Non COVID-19"
"443","RS Medika Lestari","Jl. HOS Cokroaminoto Perum Pondok Lestari Blok C1",11,"34 jam",9,NA,37,"34 jam","0215854858","36","3671",2021-08-08 18:42:48,"Non COVID-19"
"444","RSUP Dr. Sitanala Tangerang","Jl. Dr Sitanala No. 99 Kota Tangerang",4,"33 jam",4,"33 jam",18,"33 jam","0215523059","36","3671",2021-08-08 18:42:48,"Non COVID-19"
"445","RS Sari Asih Karawaci","Jl. Imam Bonjol No 38 Karawaci Sukajadi Kota Tangerang",6,NA,16,NA,4,NA,"0215522794","36","3671",2021-08-08 18:42:48,"Non COVID-19"
"446","RS An-Nisa ","Jl. Gatot Subroto No 96 Km 3 Kel. Uwung Jaya Kec. Cibodas Tangerang",3,NA,2,NA,10,NA,"08118128374","36","3671",2021-08-08 18:42:48,"Non COVID-19"
"447","RS  Mayapada","Jl. Honoris Raya Kav.6 Tangerang",17,NA,14,NA,10,NA,"081211901057","36","3671",2021-08-08 18:42:48,"Non COVID-19"
"448","RS Primaya","Jl.MH.Thamrin No.3 Cikokol Kota Tangerang",10,"33 jam",6,"33 jam",NA,NA,"081287776565","36","3671",2021-08-08 18:42:48,"Non COVID-19"
"449","RS Umum Daerah Kota Tangerang","Jl Pulau Puteri Raya Perumahan Modernland",NA,NA,NA,NA,23,"32 jam","02129720200","36","3671",2021-08-08 18:42:48,"Non COVID-19"
"450","RS Tiara ","JALAN BERINGIN RAYA NO.3,4,5 KEL.NUSA JAYA. KEC.KARAWACI",1,"6 jam",NA,NA,3,"7 jam","02129238000","36","3671",2021-08-08 18:42:48,"Non COVID-19"
"451","RS Ibu dan Anak Karunia Bunda","Jl. Aria Santika No. 28, Kel. Margasari, Kec. Karawaci, Kota Tangerang 15113",9,"33 jam",3,"33 jam",5,"33 jam","hotline tidak tersedia","36","3671",2021-08-08 18:42:48,"Non COVID-19"
"452","RS Umum Daerah Tarakan","Jl P. Irian No. 01 Skip Tarakan",30,"7 jam",28,"7 jam",59,"7 jam","085251493366","65","6571",2021-08-08 18:42:48,"Non COVID-19"
"453","RS Umum Daerah dr. Soekardjo"," Jl. Rumah Sakit 33 Tasikmalaya",4,"34 jam",9,"34 jam",65,"34 jam","0265331683","32","3278",2021-08-08 18:42:48,"Non COVID-19"
"454","RS Umum Jasa Kartini","Jl. Otto Iskandar Dinata No 15",7,NA,16,NA,38,NA,"08112163983","32","3278",2021-08-08 18:42:48,"Non COVID-19"
"455","RS Ibu dan Anak dr. Hj. Karmini EH","Jl.RSU No 56 Tasikmalaya",4,"34 jam",6,"34 jam",5,"34 jam","0265330644","32","3278",2021-08-08 18:42:48,"Non COVID-19"
"456","RS Umum Tasik Medika Citratama (TMC)","Jl. H.Z. Mustofa No. 310 Cihideung Kota Tasikmalaya",15,"6 jam",1,"6 jam",23,"6 jam","0265323555","32","3278",2021-08-08 18:42:48,"Non COVID-19"
"457","RS Ibu dan Anak Widaningsih","JL. Sutisna Senjaya No 130 Tawang Kota Tasikmalaya",4,"18 jam",7,"17 jam",7,"17 jam","0265334154","32","3278",2021-08-08 18:42:48,"Non COVID-19"
"458","RS Umum Prasetya Bunda","Jl. Ir. H. Juanda No.1, Indihiang Kota Tasikmalaya",18,"34 jam",24,"34 jam",25,"34 jam","082318337202","32","3278",2021-08-08 18:42:48,"Non COVID-19"
