"","hospital","address","bed_class1","last_update_class1","bed_class2","last_update_class2","bed_class3","last_update_class3","tlp_number","province","district","scraped_at","bed_type"
"1","RS Umum Daerah Dr. H. Yulidin Away","Jl. T. Ben Mahmud Nomor 86 A Tapaktuan",42,"kurang dari 1 menit",49,"kurang dari 1 menit",20,"kurang dari 1 menit","082198880051","11","1103",2021-08-08 18:41:47,"Non COVID-19"
"2","RS Umum Daerah Tamiang","Jl. Kesehatan Kab.Aceh Tamiang ",4,"40 menit",38,"40 menit",11,"40 menit","085372458720","11","1114",2021-08-08 18:41:48,"Non COVID-19"
"3","RS Daerah Kalabahi","Jl. Dr Sutomo Kalabahi Kab. Alor",6,"17 jam",19,"17 jam",48,"17 jam","082339126402","53","5307",2021-08-08 18:41:49,"Non COVID-19"
"4","RS Umum Mola","Jln. MASANG, RT 08 RW 04 KEL. WELAI TIMUR, KEC. TELUK MUTIARA, KAB. ALOR",NA,NA,NA,NA,1,"31 jam","08133864249","53","5307",2021-08-08 18:41:49,"Non COVID-19"
"5","RS Umum Daerah H. Abdul Manan Simatupang","Jl. Sisingamangaraja No. 310 Kisaran",17,"34 jam",10,"34 jam",31,"34 jam","081260809667","12","1208",2021-08-08 18:41:50,"Non COVID-19"
"6","RS Umum Sei Dadap","Jl. Protokol Sei Dadap-Sumut",5,"34 jam",18,"34 jam",13,"34 jam","082166064110","12","1208",2021-08-08 18:41:50,"Non COVID-19"
"7","RS Umum Wira Husada","Jl Kartini Nomor 209 Kisaran",3,NA,5,NA,12,NA,"082398963833","12","1208",2021-08-08 18:41:50,"Non COVID-19"
"8","RS Khusus Bedah BIMC","Jl. By Pass Ngurah Rai No.100X, Kuta - Badung",NA,NA,NA,NA,NA,NA,"0361761263","51","5103",2021-08-08 18:41:50,"Non COVID-19"
"9","RS Umum Daerah Balangan ","Jl. Lingkar Timur Km.1,7 Paringin Kab.Balangan ",4,"41 jam",1,NA,9,"40 jam","05262094039","63","6311",2021-08-08 18:41:51,"Non COVID-19"
"10","RS Umum Daerah Al Ihsan Provinsi Jawa Barat","  Jl. Ki Astramanggala Bale Endah Kab. Bandung",3,NA,15,NA,20,NA,"02287799430","32","3204",2021-08-08 18:41:51,"Non COVID-19"
"11","RS Umum Daerah Soreang"," Jl. Alun-Alun Utara No. 1 Soreang",11,"35 jam",37,"35 jam",28,"35 jam","0225891355","32","3204",2021-08-08 18:41:51,"Non COVID-19"
"12","RS Unggul Karsa Medika","Jl. Taman Kopo Indah III Blok H No. 1, Desa MekarRahayu, Kecamatan MargaAsih, Kabupaten Bandung",2,"34 jam",2,"34 jam",24,"34 jam","02286011220","32","3204",2021-08-08 18:41:51,"Non COVID-19"
"13","RS Umum Daerah Kesehatan Kerja","Jl. Raya Rancaekek KM. 27 NO. 612 Desa Nanjungmekar Kec. Rancaekek",2,"1 menit",7,"1 menit",15,"1 menit","0227798778","32","3204",2021-08-08 18:41:51,"Non COVID-19"
"14","RS Umum AMC ","Jl. Raya Cileunyi No.1, Cileunyi Wetan, Cileunyi, Bandung, Jawa Barat 40622",19,NA,25,NA,33,NA,"0813-1656-0227","32","3204",2021-08-08 18:41:51,"Non COVID-19"
"15","RS Umum Daerah Lembang","Jl. Raya Lembang KM.11,4 No.11 Desa Gudang Kahuripan Kec. Lembang",5,"9 jam",NA,NA,42,"9 jam","0222786879","32","3217",2021-08-08 18:41:51,"Non COVID-19"
"16","RS Karisma Cimareme","Jl. Raya Cimareme No. 235 RT. 03 RW. 01 Kec.Ngamprah",2,NA,8,NA,13,NA,"0226866221","32","3217",2021-08-08 18:41:51,"Non COVID-19"
"17","RS Umum Daerah Cikalong Wetan","Jl. Padalarang - Purwakarta KM 11 Cikalong Wetan",NA,NA,NA,NA,41,"8 jam","022868666243","32","3217",2021-08-08 18:41:51,"Non COVID-19"
"18","RS Ibu dan Anak Kartini","Jl. Letkol GA Manulang No. 46 Padalarang Bandung Barat",4,NA,3,NA,6,NA,"hotline tidak tersedia","32","3217",2021-08-08 18:41:51,"Non COVID-19"
"19","RS Ibu dan Anak Graha Medika Padalarang","Jl. Raya Padalarang Ruko Padalarang Point No. 527 ",7,NA,6,NA,8,NA,"02287785998","32","3217",2021-08-08 18:41:51,"Non COVID-19"
"20","RS Jiwa Provinsi Jawa Barat","Jl. Kolonel Masturi KM 7 Cisarua - Bandung Barat",4,"10 jam",18,"10 jam",42,"10 jam","0222700909","32","3217",2021-08-08 18:41:51,"Non COVID-19"
"21","RS Umum Cahya Kawaluyan","Jl. Parahyangan KM. 3 - Kota Baru Parahyangan Kec. Padalarang KBB",4,NA,3,NA,22,NA,"0226803700","32","3217",2021-08-08 18:41:51,"Non COVID-19"
"22","RS Umum Daerah Kabupaten Banggai ","Jl. Imam Bonjol KM 3 No. 14 Luwuk",28,"34 jam",36,"34 jam",88,"34 jam","046121820","72","7202",2021-08-08 18:41:51,"Non COVID-19"
"23","RS Umum Daerah Depati Bahrin","Jl. Jend Sudirman No.195, Kel.Parit Padang Kec.Sungailiat Propinsi Kepulauan Bangka Belitung",18,"1 menit",11,"1 menit",20,"1 menit","071792489","19","1901",2021-08-08 18:41:52,"Non COVID-19"
"24","RS  Jiwa Sungai Liat","Jl. Jend Sudirman No. 345 Kel. Parit Padang Kec. Sungai Liat ",3,"34 jam",10,"34 jam",62,"34 jam","081368334999","19","1901",2021-08-08 18:41:52,"Non COVID-19"
"25","RS Umum Daerah Sjafrie Rachman Puding Besar","Jl. Raya Sungailiat Mentok Desa Puding Besar kecamatan Puding Besar ",NA,NA,NA,NA,0,NA,"081398430909","19","1901",2021-08-08 18:41:52,"Non COVID-19"
"26","RS Umum Daerah Syarifah Ambami Rato Ebu","  Jl. Pemuda Kaffa No. 9 Bangkalan",7,"33 jam",5,"33 jam",31,"33 jam","0313095088","35","3526",2021-08-08 18:41:52,"Non COVID-19"
"27","RS Umum Daerah Kabupaten Bangli"," Jl. Brigjen Ngurah Rai No. 99X Bangli",9,"10 jam",7,NA,29,NA,"036691521","51","5106",2021-08-08 18:41:53,"Non COVID-19"
"28","RS Umum Bangli Medika Canti","Jl. Tirta Giri Kutri, LC Subak Aya, Bebalang",0,"33 jam",3,"33 jam",0,"33 jam","036691555","51","5106",2021-08-08 18:41:53,"Non COVID-19"
"29","RS Umum Daerah Ratu Zalecha","Jl Menteri Empat Martapura Kabupaten Banjar Kalimantan Selatan",31,NA,54,NA,60,NA,"05114789455","63","6303",2021-08-08 18:41:53,"Non COVID-19"
"30","RS Umum Emmanuel","Jl. Raya Purwareja Klampok - Banjarnegara",14,NA,14,NA,42,NA,"(0286) 479030","33","3304",2021-08-08 18:41:53,"Non COVID-19"
"31","RS Umum Daerah Prof. Dr. H. Anwar Makkatutu","Jl. Teratai No. 20 Kel. Pallantikang, Kec. Bantaeng",16,NA,20,NA,54,NA,"hotline tidak tersedia","73","7303",2021-08-08 18:41:53,"Non COVID-19"
"32","RS Umum Daerah Panembahan Senopati","Jl Dr. Wahidin Sudiro Husodo Bantul",5,NA,9,NA,47,NA,"hotline tidak tersedia","34","3402",2021-08-08 18:41:53,"Non COVID-19"
"33","RS Umum Santa Elisabeth","Ganjuran Sumbermulyo Bambanglipuro",2,NA,1,NA,6,NA,"02746460400","34","3402",2021-08-08 18:41:53,"Non COVID-19"
"34","RS Ibu Anak Ummi Khasanah","Jl Pemuda Ds Gandekan Bantul",1,"40 menit",0,"40 menit",0,"40 menit","0274367638","34","3402",2021-08-08 18:41:53,"Non COVID-19"
"35","RS Umum Nur Hidayah","Jl Imogiri Timur Km. 11,5 Trimulyo Jetis Bantul",3,"39 menit",6,"39 menit",30,"39 menit","085100472941","34","3402",2021-08-08 18:41:53,"Non COVID-19"
"36","RS Umum Griya Mahardika Yogyakarta","jl. Parangtritis KM 4.5 gang Wijayakusuma No 212 Yogyakarta",9,"40 menit",3,"40 menit",NA,NA,"0274445024","34","3402",2021-08-08 18:41:53,"Non COVID-19"
"37","RS Umum Daerah Banyuasin","Jl. Raya Palembang - Betung Km.48,Pangkalan Balai Banyuasin",15,"33 jam",13,"33 jam",29,"33 jam","0711891647","16","1607",2021-08-08 18:41:54,"Non COVID-19"
"38","RS Bunda Medika Jakabaring","Jl. Gubernur H.A. Bastari Jakabaring Desa Sungai Kedukan Kecamatan Rambutan",14,NA,17,NA,21,NA,"085384532735","16","1607",2021-08-08 18:41:54,"Non COVID-19"
"39","RS Umum Pusat Dr. Rivai Abdullah","Jl. Sungai Kundur Kelurahan Mariana Kec. Banyuasin I ",8,"57 menit",10,"57 menit",47,"57 menit","07117537201","16","1607",2021-08-08 18:41:54,"Non COVID-19"
"40","RS umum Daerah Banyumas","Jl. Rumah Sakit No.1 Banyumas",9,"37 jam",14,"12 jam",33,"12 jam","0281796031","33","3302",2021-08-08 18:41:54,"Non COVID-19"
"41","RS Khusus Bedah Jatiwinangun"," Jl. Jatiwinangun No.54, Purwokerto",5,NA,7,NA,14,NA,"0281632632","33","3302",2021-08-08 18:41:54,"Non COVID-19"
"42","RS Ibu dan Anak Amanah","Jl Raya Kebokura No.37 Kec Sumpiuh Kab Banyumas",2,"3 menit",6,"3 menit",1,"3 menit","0282497548","33","3302",2021-08-08 18:41:54,"Non COVID-19"
"43","RS Umum Islam Purwokerto","Jl. H. Masyuri Rejasari No 39 Purwokerto",3,"3 menit",3,"3 menit",7,"3 menit","0281630019","33","3302",2021-08-08 18:41:54,"Non COVID-19"
"44","RS Umum Daerah Ajibarang","    Jl. Raya Pancasan No.1,Ajibarang Banyumas",9,"12 jam",18,"12 jam",37,"11 jam","02816570004","33","3302",2021-08-08 18:41:54,"Non COVID-19"
"45","RS Umum Daerah Blambangan","  Jl. Letkol Istiqlah No. 49 Banyuwangi",14,"11 jam",25,"11 jam",60,"11 jam","0333421118 ","35","3510",2021-08-08 18:41:54,"Non COVID-19"
"46","RS Yasmin","Jl. Letkol Istiqlah Nomor 80-84 Banyuwangi",0,"35 jam",0,"35 jam",5,"35 jam","0333424671","35","3510",2021-08-08 18:41:54,"Non COVID-19"
"47","RS Nahdlatul Ulama Banyuwangi","Jl. Raya Mangir No. 9, Kec. Rogojampi, Banyuwangi",4,"33 jam",3,"33 jam",4,"33 jam","0333632965","35","3510",2021-08-08 18:41:54,"Non COVID-19"
"48","RS Al Huda ","Jl. Raya Gambiran No. 225, Desa Gambiran, Kec. Gambiran, Kab. Banyuwangi",8,"13 jam",16,NA,20,"13 jam","0333842034","35","3510",2021-08-08 18:41:54,"Non COVID-19"
"49","RS Umum PKU Muhammadiyah Rogojampi","Jalan Diponegoro Nomor 20 Rogojampi, Kab. Banyuwangi",10,NA,19,NA,27,NA,"0333631149","35","3510",2021-08-08 18:41:54,"Non COVID-19"
"50","RS Ibu dan Anak Abdhi Famili","Jl. Diponegoro No. 5 Wringinrejo RT 005 / RW 005 Gambiran Banyuwangi",2,"40 jam",4,"40 jam",8,"40 jam","082337503418","35","3510",2021-08-08 18:41:54,"Non COVID-19"
"51","RS Al-Rohmah Banyuwangi","Jl. A. Yani No. 37 Jajag Gambiran, Banyuwangi",5,NA,14,"40 menit",12,NA,"0333397267","35","3510",2021-08-08 18:41:54,"Non COVID-19"
"52","RS Ibu dan Anak Rahayu Medika","Jl. Pekulo-Sukomukti No.09, Kebaman, Srono, Banyuwangi",NA,NA,3,NA,21,NA,"0333911542","35","3510",2021-08-08 18:41:54,"Non COVID-19"
"53","RS Umum Batara Siang","  Jl. Sultan Hasanudin 7 Pangkajene",55,"36 jam",22,"36 jam",21,"36 jam","0811415118","73","7310",2021-08-08 18:41:56,"Non COVID-19"
"54","RS Umum Qim","Jl. Urip Sumoharjo, Sambong",0,NA,2,NA,7,NA,"02854495222","33","3325",2021-08-08 18:41:56,"Non COVID-19"
"55","RS Umum Daerah Limpung","Jl. Dr. Soetomo No. 17A Limpung 51271",9,NA,NA,NA,NA,NA,"02854468362","33","3325",2021-08-08 18:41:56,"Non COVID-19"
"56","RS Umum Daerah Haji Abdoel Madjid Batoe","Jl. Prof. Dr. Sri Soedewi  Muara Bulian",21,"32 jam",9,"32 jam",58,"32 jam","074321043","15","1504",2021-08-08 18:41:56,"Non COVID-19"
"57","RS Umum Annisa","Jl. Cikarang Baru No.31 Cikarang Utara Bekasi",56,"35 jam",9,"35 jam",25,"35 jam","081219792097","32","3216",2021-08-08 18:41:57,"Non COVID-19"
"58","Siloam Hospitals Lippo Cikarang","Jl. MH Thamrin Kav.105 Bekasi",8,"13 jam",17,"13 jam",14,"13 jam","02129636911","32","3216",2021-08-08 18:41:57,"Non COVID-19"
"59","RS Umum Daerah Kab.Bekasi"," Jl. Teuku Umar Cibitung,Bekasi",8,NA,19,NA,31,"11 jam","02188374444","32","3216",2021-08-08 18:41:57,"Non COVID-19"
"60","RS Amanda Cikarang Selatan","Jl. Raya Serang No. 83 Desa Sukadami Cikarang Selatan Kab. Bekasi",10,NA,11,NA,12,NA,"0218971643","32","3216",2021-08-08 18:41:57,"Non COVID-19"
"61","RS Umum Dokter Adam Talib","JL. TEUKU UMAR NO. 25 CIKARANG BARAT",NA,NA,NA,NA,NA,NA,"082112767778","32","3216",2021-08-08 18:41:57,"Non COVID-19"
"62","RS Umum Cibitung Medika","Jl. H. Bosih No.117 Cibitung Kabupaten Bekasi",8,NA,8,NA,16,NA,"02188323444","32","3216",2021-08-08 18:41:57,"Non COVID-19"
"63","RS Mitra Medika Narom","Jl. Desa Jatiwangi Cikedokan Kp. Kamurang",6,"36 jam",5,"36 jam",47,"36 jam","02189983741","32","3216",2021-08-08 18:41:57,"Non COVID-19"
"64","RS Uni Medika Setu Bekasi","Jl. Raya setu No.99 Desa Lubang Buaya Kec. Setu",5,NA,5,NA,18,NA,"085891000553","32","3216",2021-08-08 18:41:57,"Non COVID-19"
"65","RS Umum Kartika Husada Setu","Jl. Raya Burangkeng Desa Burangkeng Rt. 001 Rw.06 Kec. Setu",9,NA,6,NA,36,NA,"02182610003","32","3216",2021-08-08 18:41:57,"Non COVID-19"
"66","RS Umum Tiara","Jl. Raya Babelan No. 73 Desa Kebalen Kec. Babelan Kab. Bekasi",5,NA,4,NA,4,NA,"081388871708","32","3216",2021-08-08 18:41:57,"Non COVID-19"
"67","RS Umum Omni Cikarang","Komplek Oasis Kav. 1, Jl. Raya Cikarang Cibarusah, Kelurahan Sukaresmi, Kecamatan Cikarang Selatan.",21,"8 jam",11,"8 jam",16,"8 jam","02129779999","32","3216",2021-08-08 18:41:57,"Non COVID-19"
"68","RS Umum Pinna","Jl. Karang Satria No. 4-5 Bekasi",1,"14 jam",15,NA,10,NA,"0218827554","32","3216",2021-08-08 18:41:57,"Non COVID-19"
"69","RS Umum As-Shofwan","Jl. Raya Karawang - Bekasi km.30 Ds. Bojongsari, Kec. Kedungwaringin.",NA,NA,3,NA,25,"6 jam","02189141890","32","3216",2021-08-08 18:41:57,"Non COVID-19"
"70","RS Umum Daerah  Kab.Belitung Timur","Jl. Raya Manggar Gantung Desa Padang Kecamatan Manggar",10,"34 jam",19,"34 jam",40,"34 jam","081949244641","19","1906",2021-08-08 18:41:58,"Non COVID-19"
"71","RS Sito Husada","Jl. KH.Dewantara No.15,Atambua Belu",3,NA,2,NA,27,NA,"hotline tidak tersedia","53","5306",2021-08-08 18:41:58,"Non COVID-19"
"72","RS Umum Daerah  Bengkalis","Jl Kelapapati Tengah No.90, Bengkalis",15,"8 jam",15,"8 jam",15,"8 jam","07667008400","14","1408",2021-08-08 18:42:00,"Non COVID-19"
"73","RS Umum  Permata Hati","Jl Jend. Sudirman No. 37",2,"13 jam",8,NA,23,NA,"081261823811","14","1408",2021-08-08 18:42:00,"Non COVID-19"
"74","RS Hana Charitas Arga Makmur","Jl. Ir. Soekarno No.12 Rama Agung Arga Makmur, Bengkulu Utara",10,NA,11,NA,24,NA,"0737522300","17","1703",2021-08-08 18:42:01,"Non COVID-19"
"75","RS Umum Daerah Srengat Kab. Blitar","Jl. Raya Dandong RT. 02/RW. 03 Kec. Srengat",2,"10 jam",3,"10 jam",4,"10 jam","03425651555","35","3505",2021-08-08 18:42:02,"Non COVID-19"
"76","RS Umum An-Nisaa","Jl. Suparyono Timur No. 1, Bajang Talun Blitar",6,NA,3,NA,1,NA,"0342692999","35","3505",2021-08-08 18:42:02,"Non COVID-19"
"77","RS Paru Dr. M. Goenawan Partowidigdo","Jl. Raya Puncak KM.83, Po Box 28 Cisarua Bogor 16750",NA,NA,NA,NA,5,"11 menit","02518253630","32","3201",2021-08-08 18:42:03,"Non COVID-19"
"78","RS Umum Daerah Ciawi","Jl. Raya Puncak 479 Ciawi Bogor",9,"2 menit",10,"2 menit",18,"2 menit","082119041792","32","3201",2021-08-08 18:42:03,"Non COVID-19"
"79","RS Umum Daerah Leuwiliang","Jl. Raya Cibeber - Leuwiliang Bogor",38,"4 menit",21,"4 menit",25,"4 menit","0251 8643490","32","3201",2021-08-08 18:42:03,"Non COVID-19"
"80","RS Umum Annisa","JL. Raya Karanggan No. 02 Puspasari, Citeureup Bogor",1,NA,21,NA,7,NA,"02183710769","32","3201",2021-08-08 18:42:03,"Non COVID-19"
"81","RS Umum Bina Husada","Jl. Mayor Oking Jaya Atmaja KM1 No.101 Cibinong - Bogor",9,NA,7,NA,4,NA,"02187911000","32","3201",2021-08-08 18:42:03,"Non COVID-19"
"82","RS Umum Citama","Jl. Raya Pabuaran No. 52 Bogor",4,NA,38,NA,18,NA,"02187985555","32","3201",2021-08-08 18:42:03,"Non COVID-19"
"83","RS Umum Daerah Cileungsi"," Jl. Raya Cileungsi-Jonggol Km.10 Cileungsi Kab. Bogor",0,"23 menit",1,"23 menit",0,"23 menit","02189934668","32","3201",2021-08-08 18:42:03,"Non COVID-19"
"84","RS Umum Karya Bhakti Pratiwi","Jl. Raya Dramaga KM. 7 Bogor",8,"22 menit",29,"22 menit",22,"22 menit","02518626666","32","3201",2021-08-08 18:42:03,"Non COVID-19"
"85","RS Umum Daerah Dr. R. Sosodoro Djatikoesoemo"," Jl. Veteran No 36, Bojonegoro",21,"35 jam",24,"35 jam",51,"35 jam","08113224972","35","3522",2021-08-08 18:42:03,"Non COVID-19"
"86","RS Umum Daerah Sumberrejo","Jl. Raya No. 231 Sumberrejo, Bojonegoro",2,"32 jam",0,"32 jam",22,"32 jam","0353331530","35","3522",2021-08-08 18:42:03,"Non COVID-19"
"87","RS Umum Daerah Tombulilato","  Ds.Inomata jln.Trans Sulawesi Pantai selatan Km. 70",2,"16 jam",1,"41 jam",28,"16 jam","085394107787","75","7504",2021-08-08 18:42:04,"Non COVID-19"
"88","RS Umum  Karanggede Sisma Medika","Jl. Raya Karanggede - Solo KM.1, Boyolali",3,NA,7,NA,29,NA,"0298610600","33","3309",2021-08-08 18:42:05,"Non COVID-19"
"89","RS Umum Daerah Simo","    Jl. Kebon Ijo Ds.Simo Kec.Simo, Boyolali",5,"12 menit",9,"12 menit",26,"12 menit","02763294719","33","3309",2021-08-08 18:42:05,"Non COVID-19"
"90","RS Umum Hidayah Boyolali","Kragilan, Mojosongo, Boyolali",12,"41 menit",18,"41 menit",13,"41 menit","0276324614","33","3309",2021-08-08 18:42:05,"Non COVID-19"
"91","RS Umum Islam Boyolali","Jl. Raya Boyolali Klaten Kemiri Mojosongo",8,NA,11,NA,19,NA,"(0276) 3282158","33","3309",2021-08-08 18:42:05,"Non COVID-19"
"92","RS Umum Daerah Brebes","Jl. Jend.Sudirman No.181, Brebes",15,"8 jam",12,"8 jam",80,"8 jam","0283-671431","33","3329",2021-08-08 18:42:05,"Non COVID-19"
"93","RS Umum Daerah Kab. Buleleng","     Jl. Ngurah Rai 30 Singaraja",2,"34 jam",9,"34 jam",36,"34 jam","036222046","51","5108",2021-08-08 18:42:05,"Non COVID-19"
"94","RS Umum Daerah Tangguwisia","Jl. Singaraja-Seriri, Desa Tangguwisia, Kecamatan Seririt, Kabupaten Buleleng, Provinsi Bali",1,NA,2,NA,8,NA,"03623361387","51","5108",2021-08-08 18:42:05,"Non COVID-19"
"95","RS Giri Emas","Jl. Raya Sangsit, Desa Giri Emas Kecamatan Sawan Kabupaten Buleleng",2,NA,4,NA,20,"13 jam","03623303884","51","5108",2021-08-08 18:42:05,"Non COVID-19"
"96","RS Umum Daerah Kabupaten Buton Selatan"," JL GAJAH MADA Kel. Laompo Kec. Batauga Kab. Buton Selatan Telp/Fax.(0402)",NA,NA,2,"32 jam",18,"32 jam","085340425378","74","7415",2021-08-08 18:42:06,"Non COVID-19"
"97","RS Umum Permata Bunda","Jl. Mr. Iwa Kusumasomantri No.1 Ciamis",1,NA,9,NA,11,NA,"0265771650","32","3207",2021-08-08 18:42:07,"Non COVID-19"
"98","RS Umum Al-Arif"," Jl. R.E. Martadinata No.158 B, Baregbeg - Ciamis",11,NA,16,NA,30,NA,"0265777391","32","3207",2021-08-08 18:42:07,"Non COVID-19"
"99","RS Umum Dadi Keluarga Ciamis","Jl. RE. Martadinata Nomor 333-335 Baregbeg, Ciamis",3,"35 jam",12,"35 jam",16,"35 jam","02652750777","32","3207",2021-08-08 18:42:07,"Non COVID-19"
"100","RS Khusus Bedah RSOP Ciamis","Jl. Raya Ciamis Banjar KM 7 No. 341 RT 16 RW 06 Desa Cijeungjing Kec Cijeungjing",6,NA,4,NA,14,NA,"02657600450","32","3207",2021-08-08 18:42:07,"Non COVID-19"
"101","RS Umum Daerah Cimacan","Jl. Raya Cimacan No.17, Cianjur",10,"4 menit",15,"4 menit",26,"4 menit","02632950771","32","3203",2021-08-08 18:42:07,"Non COVID-19"
"102","RS Umum Daerah Cilacap","Jl. Gatot Subroto 28 Cilacap RT 04 / RW O5",11,"19 jam",37,"19 jam",37,"19 jam","0282533010","33","3301",2021-08-08 18:42:07,"Non COVID-19"
"103","RS Umum Islam Fatimah","Jl. Ir.H.Juanda No.20 Cilacap",11,"43 menit",16,"43 menit",10,"43 menit","0282542396","33","3301",2021-08-08 18:42:07,"Non COVID-19"
"104","RS Umum Daerah Waled"," Jl. Prabu Kiansantang No. 4 Waled, Cirebon",20,"28 menit",22,"28 menit",98,"28 menit","0231661275","32","3209",2021-08-08 18:42:08,"Non COVID-19"
"105","RS Pertamina Cirebon","Jl. Patra Raya Klayan No 1 Cirebon",1,"12 jam",2,"12 jam",3,NA,"08112433338","32","3209",2021-08-08 18:42:08,"Non COVID-19"
"106","RS Umum Daerah Arjawinangun","Jl. Palimanan - Jakarta KM. 2 No. 1  Arjawinangun",11,"35 jam",29,"35 jam",133,"35 jam","0231358335","32","3209",2021-08-08 18:42:08,"Non COVID-19"
"107","RS Umum Mitra Plumbon","Jl. Raya Plumbon Km.11 Cirebon",19,NA,43,NA,44,NA,"0231323100","32","3209",2021-08-08 18:42:08,"Non COVID-19"
"108","RS Umum Permata Cirebon","Jl. Tuparev No.117 Cirebon",12,NA,46,NA,34,NA,"02318338877","32","3209",2021-08-08 18:42:08,"Non COVID-19"
"109","RS Umum Sumber Waras","Jl. Urip Sumoharjo No.5 Ciwaringin, Kab. Cirebon",19,"2 menit",23,"2 menit",11,"2 menit","0231341079","32","3209",2021-08-08 18:42:08,"Non COVID-19"
"110","RS Jantung Hasna Medika","Jl. Raden Gilap No 8 Palimanan, Kabupaten Cirebon",8,"1 menit",20,"1 menit",17,"1 menit","0231343405","32","3209",2021-08-08 18:42:08,"Non COVID-19"
"111","RS Umum Daerah Sidikalang","Jl Rumah Sakit No 19, Sidikalang",9,"10 jam",23,"10 jam",45,"10 jam","0627000022442","12","1210",2021-08-08 18:42:08,"Non COVID-19"
"112","RS Umum Dearah Deli Serdang","Jl. Thamrin Lubuk Pakam",10,"31 jam",10,"7 jam",38,"7 jam","085297825601","12","1212",2021-08-08 18:42:09,"Non COVID-19"
"113","RS Umum Sari Mutiara Lubuk Pakam","Jl Medan No.17,Lubuk Pakam",13,"6 jam",83,"32 jam",143,"6 jam","082165612376 ","12","1212",2021-08-08 18:42:09,"Non COVID-19"
"114","RS Umum Yoshua","Jl. Medan Lubuk Pakam N0. 70",5,"10 jam",3,"10 jam",6,"10 jam","hotline tidak tersedia","12","1212",2021-08-08 18:42:09,"Non COVID-19"
"115","RS Umum Pancur Batu","Jl. Jamin Ginting KM. 17 Desa Tengah Kec. Pancur Batu",4,NA,11,NA,9,NA,"081376257161","12","1212",2021-08-08 18:42:09,"Non COVID-19"
"116","RS Grandmed ","Jl Medan km. 25 no. 66 Lubuk Pakam",12,"9 jam",8,"9 jam",10,"9 jam","085358431190","12","1212",2021-08-08 18:42:09,"Non COVID-19"
"117","RS Umum Haji Medan","Jl RS Haji Medan Estate",17,"12 jam",1,"12 jam",28,"12 jam","0616619520","12","1212",2021-08-08 18:42:09,"Non COVID-19"
"118","RS Umum Daerah Sunan Kalijaga"," Jl. Sultan Fatah No. 669/50,Demak",26,NA,3,NA,52,NA,"0291685018","33","3321",2021-08-08 18:42:10,"Non COVID-19"
"119","RS Umum Islam NU Demak","Jl. Jogoloyo No.9, Kec. Wonosalam, Demak",5,"35 jam",7,"35 jam",22,"35 jam","02916904000","33","3321",2021-08-08 18:42:10,"Non COVID-19"
"120","RS Umum Pelita Anugerah","Jl. Raya Bandung Rejo Km 11,5, Mranggen Demak",11,NA,31,NA,11,NA,"0246725555","33","3321",2021-08-08 18:42:10,"Non COVID-19"
"121","RS Hj. Fatimah Sulhan PKU Muhammadiyah Demak","Jl. Sultan Hadiwijaya No. 18 Mangunjiwan",12,NA,8,NA,18,NA,"hotline tidak tersedia","33","3321",2021-08-08 18:42:10,"Non COVID-19"
"122","RS Pratama Manggelewa","Jl. Lintas Calabai Desa Doromelo Kecamatan Manggelewa Kabupaten Dompu",NA,NA,NA,NA,33,"14 jam","hotline tidak tersedia","52","5205",2021-08-08 18:42:10,"Non COVID-19"
"123","RS Umum Daerah Pendau Tambu Kab Donggala","Jl. Mapane Tambu. Kec. Baselang",16,"30 jam",25,"30 jam",19,"30 jam","085341298597","72","7205",2021-08-08 18:42:10,"Non COVID-19"
"124","RS Umum Daerah Fakfak","Jl. Jend Sudirman Fak Fak",8,"6 jam",8,"6 jam",41,"6 jam","082199455159","91","9101",2021-08-08 18:42:12,"Non COVID-19"
"125","RS Medina","Jl. Raya Wanaraja No. 500 RT. 004 RW. 008 Desa Cinunuk Kec. Wanaraja",0,NA,0,NA,8,NA,"hotline tidak tersedia","32","3205",2021-08-08 18:42:13,"Non COVID-19"
"126","RS Umum Muhammad Ali Kasim","Jl.Pangur-Sangir, Kec Dabun Gelang",21,NA,NA,NA,48,NA,"081360082884","11","1113",2021-08-08 18:42:13,"Non COVID-19"
"127","RS Umum Daerah Sanjiwani Gianyar","    Jl. Ciung Wenara No.2 Gianyar",NA,NA,NA,NA,15,NA,"0361943524","51","5104",2021-08-08 18:42:13,"Non COVID-19"
"128","RS Umum Premagana","Jl. Hyang Sangsi No.2 Komp.Perumahan Chandra Ayu Br. Tubuh,Batubulan,Sukawati - Gianyar",8,"9 jam",3,"9 jam",2,"9 jam","0361296389","51","5104",2021-08-08 18:42:13,"Non COVID-19"
"129","RS Umum Ari Canti","Jl. Raya Mas Ubud, Kab.Gianyar",2,NA,3,NA,5,NA,"0361974573","51","5104",2021-08-08 18:42:13,"Non COVID-19"
"130","RS Umum Famili Husada","Jl. Astina Timur No. 8A Samplangan, Kecamatan Gianyar, Kabupaten Gianyar",1,NA,0,NA,0,NA,"03618493344","51","5104",2021-08-08 18:42:13,"Non COVID-19"
"131","RS Umum Kasih Ibu Saba","Jl. Raya Pantai Saba No. 9, Saba, Blahbatuh, Gianyar (80581)",4,"34 jam",4,"34 jam",NA,NA,"03613003333","51","5104",2021-08-08 18:42:13,"Non COVID-19"
"132","RS Umum Payangan","Jl. Giri Kesuma BR. Melinggih Payangan Gianyar 80572",3,NA,7,NA,12,NA,"03619088087","51","5104",2021-08-08 18:42:13,"Non COVID-19"
"133","RS Umum Yapika","Jl. Abdul Kadir Dg. Suro No.140 Kel. Samata Kec. Somba Opu",14,NA,37,NA,30,NA,"hotline tidak tersedia","73","7306",2021-08-08 18:42:14,"Non COVID-19"
"134","RS Umum Daerah Ibnu Sina Kab. Gresik","Jl. Dr. Wahidin Sudirohusodo No. 243B Gresik",20,"10 jam",29,"10 jam",28,"10 jam","0313951239","35","3525",2021-08-08 18:42:14,"Non COVID-19"
"135","RS Semen Gresik","Jl. R A Kartini No. 280 Kel. Tlogopatut Kec. Gresik, Kab. Gresik",15,"9 jam",19,"9 jam",31,"9 jam","0313987840","35","3525",2021-08-08 18:42:14,"Non COVID-19"
"136","RS Petrokimia Gresik","Jl. Jend. A. Yani No. 69 Kel. Ngipik, Kec. Ngipik, Kab. Gresik",0,NA,0,NA,6,NA,"0313978658","35","3525",2021-08-08 18:42:14,"Non COVID-19"
"137","RS Muhammadiyah Gresik","Jl. KH. Kholil 88, Kel. Kemuteran, Kec. Gresik",8,NA,1,NA,4,NA,"0313981275","35","3525",2021-08-08 18:42:14,"Non COVID-19"
"138","RS Umum Wates Husada","Jl Raya Wates Utara Kec. Balongpanggang Kab. Gresik",5,"31 jam",3,"31 jam",0,NA,"0317922351","35","3525",2021-08-08 18:42:14,"Non COVID-19"
"139","RS Umum Panti Rahayu","Jl. R Suprapto No.6,Purwodadi",64,NA,28,NA,27,NA,"0292421087","33","3315",2021-08-08 18:42:14,"Non COVID-19"
"140","RS Umum Daerah Wonosari","Jl Taman Bakti No. 06 Wonosari",9,"11 menit",18,"11 menit",38,"11 menit","0274391007","34","3403",2021-08-08 18:42:14,"Non COVID-19"
"141","RS Umum Panti Rahayu","Jl Wonosari-Ponjong Km 7 Kelor Karangmojo Gunungkidul",2,NA,2,NA,4,NA,"02742901454","34","3403",2021-08-08 18:42:14,"Non COVID-19"
"142","RS Umum PKU Muhammadiyah Wonosari","Jalan Lingkar Utara Kemorosari II, Piyaman Wonosari Gunungkidul DIY",0,"11 menit",3,"11 menit",8,"11 menit","hotline tidak tersedia","34","3403",2021-08-08 18:42:14,"Non COVID-19"
"143","RS Umum Daerah Saptosari","Karang Jetis Saptosari Gunungkidul",0,"11 menit",6,"11 menit",2,"11 menit","02742910827","34","3403",2021-08-08 18:42:14,"Non COVID-19"
"144","RS Umum Ceria","Jl. Jend. Sudirman No. 10 Hamalau Kandangan",8,"42 jam",15,"42 jam",5,"42 jam","051723865","63","6306",2021-08-08 18:42:15,"Non COVID-19"
"145","RS Umum Daerah Daha Sejahtera"," Jl Pihanin Raya, Desa Pihanin Kecamatan Daha Selatan Kabupaten Hulu Sungai Selatan",NA,NA,NA,NA,10,"32 jam","0811501120","63","6306",2021-08-08 18:42:15,"Non COVID-19"
"146","RS Umum Daerah  H Damanhuri Barabai","        Jl. Murakata No. 4 Barabai",11,NA,11,NA,43,NA,"085249808800","63","6307",2021-08-08 18:42:16,"Non COVID-19"
"147","RS Umum Pertamina Balongan Indramayu","Jl. Bumi Patra No. 1 Komplek Perum Pertamina Indramayu.",2,NA,12,NA,11,NA,"08112288545","32","3212",2021-08-08 18:42:16,"Non COVID-19"
"148","RS Umum Daerah Mursid Ibnu Syafiuddin","Jl. Raya Krangkeng Km. 28 Kecamatan Krangkeng",NA,NA,NA,NA,15,NA,"081294060900","32","3212",2021-08-08 18:42:16,"Non COVID-19"
"149","RS Syahid Al Irsyad","Jl. Jendral Sudirman No. 240",NA,NA,5,"9 jam",NA,NA,"081313113797","32","3212",2021-08-08 18:42:16,"Non COVID-19"
"150","RS Mitra Plumbon Indramayu","Jl. By Pass Jalan Baru Desa Ujungaris Kec. Widasari Kab. Indramayu",7,"11 jam",12,"11 jam",25,"11 jam","02347142333","32","3212",2021-08-08 18:42:16,"Non COVID-19"
