"","hospital","address","bed_class1","last_update_class1","bed_class2","last_update_class2","bed_class3","last_update_class3","tlp_number","province","district","scraped_at","bed_type"
"459","RS Umum Permata Bunda","Jl. HR. Wasita Kusumah No. 1 Indihiang Kota Tasikmalaya",2,NA,2,NA,0,NA,"08112118830","32","3278",2021-08-08 18:42:48,"Non COVID-19"
"460","RS Umum Daerah Dr. H. Chasan Boesoirie Ternate","Jl. Cempaka Kel. Tanah Tinggi Kota Ternate",46,"32 jam",34,"32 jam",29,"32 jam","hotline tidak tersedia","82","8271",2021-08-08 18:42:49,"Non COVID-19"
"461","RS Umum Panti Rapih","Jl. Cik Di Tiro 30 Yogyakarta",2,NA,3,NA,5,NA,"0274552118","34","3471",2021-08-08 18:42:50,"Non COVID-19"
"462","RS Bethesda Yogyakarta","Jl Jend. Sudirman No. 70 Kotabaru Yogyakarta",21,NA,34,NA,38,NA,"0274586688","34","3471",2021-08-08 18:42:50,"Non COVID-19"
"463","RS  Mata Dr. Yap","Jl Cik Di Tiro No. 5 Yogyakarta",15,"10 jam",6,"10 jam",5,"10 jam","hotline tidak tersedia","34","3471",2021-08-08 18:42:50,"Non COVID-19"
"464","RS Umum Daerah dr. Loekmono Hadi","    Jl. Dr. Lukmonohadi No.19,Kudus",23,"35 jam",21,"35 jam",37,"34 jam","0291444001","33","3319",2021-08-08 18:42:51,"Non COVID-19"
"465","RS Ibu dan Anak Harapan Bunda","JL Kudus Jepara km 4 garung lor kaliwungu Kudus",2,"10 jam",5,"10 jam",10,"10 jam","082328594821","33","3319",2021-08-08 18:42:51,"Non COVID-19"
"466","RS Umum Mardi Rahayu","Jl. AKBP R Agil 110,Kudus",8,NA,3,NA,7,NA,"0291434707","33","3319",2021-08-08 18:42:51,"Non COVID-19"
"467","RS Umum  Islam Sunan Kudus","Jl. Kudus Permai No.1, Kaliwungu, Kudus",7,"35 jam",13,"35 jam",22,"35 jam","0291432008","33","3319",2021-08-08 18:42:51,"Non COVID-19"
"468","RS Umum Daerah Wates","Jl Tentara Pelajar Km.1 No.5 Wates Kulon Progo",20,NA,19,NA,34,"49 menit","0274773169","34","3401",2021-08-08 18:42:51,"Non COVID-19"
"469","RS Umum Rizki Amalia Medika","Jl raya Brosot - Wates Km.5 Jogahan Bumirejo Lendah Kulon Progo",4,"10 jam",10,"14 jam",2,"14 jam","02747721425","34","3401",2021-08-08 18:42:51,"Non COVID-19"
"470","RS Umum Rizki Amalia","Jl Wates-Purworejo Km.10, Kalidengen, Temon, KP",4,"12 menit",2,"12 menit",12,"12 menit","02747721568","34","3401",2021-08-08 18:42:51,"Non COVID-19"
"471","RS Umum Daerah Nyi Ageng Serang","Jl Sentolo - Muntilan KM 0,3",3,NA,15,NA,17,NA,"02742890181","34","3401",2021-08-08 18:42:51,"Non COVID-19"
"472","RS Umum Daerah 45 Kuningan","Jl. Jendral Sudirman No. 68 Kuningan",16,NA,14,NA,31,NA,"0232871885","32","3208",2021-08-08 18:42:51,"Non COVID-19"
"473","RS Umum Juanda","Jl. Ir. H. Juanda No. 207, Kuningan",24,"10 jam",19,"10 jam",33,"10 jam","0232876433","32","3208",2021-08-08 18:42:51,"Non COVID-19"
"474","RS Umum Daerah Linggajati Kuningan","Jl. Bandorasa - Cilimus No.36 Kec.Cilimus  Kab. Kuningan",6,NA,19,NA,25,NA,"0232614884","32","3208",2021-08-08 18:42:51,"Non COVID-19"
"475","RS Umum KMC Luragung","Dusun Rahayu RT.002/001 Desa Cirahayu Kec. Luragung Kab. Kuningan",5,"6 jam",19,"6 jam",40,"6 jam","02328900112","32","3208",2021-08-08 18:42:51,"Non COVID-19"
"476","RS Jantung Hasna Medika Kuningan","Jl. Raya Cigugur Lingkungan Manis RT. 030 RW. 011 Kecamatan Cigugur",3,"2 menit",5,"2 menit",13,"1 menit","02328611111","32","3208",2021-08-08 18:42:51,"Non COVID-19"
"477","RS Mitra Husada Ciawigebang","Jl Raya Siliwangi No. 151 Ciawigebang",NA,NA,6,NA,14,NA,"0232878560","32","3208",2021-08-08 18:42:51,"Non COVID-19"
"478","RS Permata Kuningan","Jl. Cut Nyak Dien RT. 007 RW. 002 45513",NA,NA,4,"34 jam",70,"34 jam","02328905555","32","3208",2021-08-08 18:42:51,"Non COVID-19"
"479","RS Umum Elpi Al Azis","Jl Wr. Supratman ",8,NA,5,NA,1,NA,"hotline tidak tersedia","12","1207",2021-08-08 18:42:52,"Non COVID-19"
"480","RS Tk. IV Lahat","Jl. Letjen harun sohar No.26,Lahat",7,"11 jam",25,"11 jam",16,"10 jam","081377951551","16","1604",2021-08-08 18:42:53,"Non COVID-19"
"481","RS Umum Daerah Kabupaten Lamandau","Jl. Trans Kalimantan KM.04, Desa Kujan, Kec. Bulik",22,NA,9,NA,113,NA,"05322067382","62","6207",2021-08-08 18:42:53,"Non COVID-19"
"482","RS Ibu dan Anak Fatimah Lamongan","Jl. Pahlawan Selatan No. 18",0,"50 menit",16,"50 menit",14,"50 menit","0322322155","35","3524",2021-08-08 18:42:53,"Non COVID-19"
"483","RS Umum Daerah Dr. Soegiri Lamongan","Jl. Kusuma Bangsa No. 7 Lamongan",30,NA,36,"33 jam",34,"32 jam","0322321718","35","3524",2021-08-08 18:42:53,"Non COVID-19"
"484","RS Islam Nashrul Ummah","  Jl. Merpati No.62, Lamongan",9,"11 jam",18,"11 jam",22,"11 jam","0322321522","35","3524",2021-08-08 18:42:53,"Non COVID-19"
"485","RS Umum dr. Suyudi","Jl. Deandles Paciran,Kecamatan Paciran, Kab. Lamongan",6,"34 jam",11,"34 jam",5,"34 jam","0322661412","35","3524",2021-08-08 18:42:53,"Non COVID-19"
"486","RS Muhammadiyah Babat","Jl. KH. Ahmad Dahlan No. 14 Babat, Lamongan ",6,"42 menit",6,"42 menit",21,"42 menit","0322451391","35","3524",2021-08-08 18:42:53,"Non COVID-19"
"487","RS Umum Harapan Bunda","  Jl. Raya Lintas Sumatera, Seputih Jaya No.31, Kec. Gunung Sugih, Kab. Lampung Tengah",1,"27 menit",4,"27 menit",17,"27 menit","082186233531","18","1805",2021-08-08 18:42:54,"Non COVID-19"
"488","RS Umum Kartini","Jl. KARTINI NO. 104 KALIREJO",11,NA,17,NA,25,NA,"0729370028","18","1805",2021-08-08 18:42:54,"Non COVID-19"
"489","RS Ibu Anak Puri Adhya Paramita","Jl. SULTAN AGUNG NO. 5 BANDAR JAYA - TERBANGGI BESAR ",5,NA,4,NA,7,NA,"0725529399","18","1805",2021-08-08 18:42:54,"Non COVID-19"
"490","RS Umum Az - Zahra","Jl. Kartini No. 109 Kalirejo , Kec. Kalirejo,",19,"11 jam",18,"10 jam",31,"10 jam","0729370089","18","1805",2021-08-08 18:42:54,"Non COVID-19"
"491","RS Ibu Anak Puti Bungsu","Jalan S. Parman No 02 Bandar Jaya Timur",3,"34 jam",NA,NA,0,"9 jam","072525065","18","1805",2021-08-08 18:42:54,"Non COVID-19"
"492","RS Umum Daerah May Jen HM Ryacudu","Jl. Jend.Sudirman No.2 Kotabumi",7,"31 jam",24,"31 jam",57,"31 jam","072422095","18","1806",2021-08-08 18:42:54,"Non COVID-19"
"493","RS Candimas Medical Center","Jl. Alamsyah Ratu Perwira Negara No. 47 Kotabumi Selatan",1,NA,11,"14 jam",13,"14 jam","082181549355","18","1806",2021-08-08 18:42:54,"Non COVID-19"
"494","RS Medika Insani","Jl. Sumber Jaya No. 667 Desa Tanjung Baru Kecamatan Bukit Kemuning Kabupaten Lampung Utara",4,NA,6,"15 jam",10,NA,"085279410025","18","1806",2021-08-08 18:42:54,"Non COVID-19"
"495","RS Umum Wampu Norita","Dusun II Kedondong Barat Desa Jentera Stabat Kecamatan Wampu No.86 Km.46",NA,NA,7,"11 jam",18,"11 jam","hotline tidak tersedia","12","1213",2021-08-08 18:42:54,"Non COVID-19"
"496","RS Umum Putri Bidadari","Stabat Tanjung Pura KM 45",24,NA,69,NA,60,NA,"085361517988","12","1213",2021-08-08 18:42:54,"Non COVID-19"
"497","RS Misi Lebak","Jl. Multatuli No.41 Rangkas Bitung",19,"3 jam",3,NA,8,"3 jam","0252201014","36","3602",2021-08-08 18:42:55,"Non COVID-19"
"498","RS Umum Daerah Lebong","Desa Muning Agung Kecamatan Lebong Sakti",2,"34 jam",13,"34 jam",19,"34 jam","082281280910","17","1707",2021-08-08 18:42:55,"Non COVID-19"
"499","RS Umum Daerah dr. Achmad Darwis","Jl. Tan Malaka No.1, Kec.Suliki",16,"31 jam",7,NA,33,NA,"082392905205","13","1308",2021-08-08 18:42:55,"Non COVID-19"
"500","RS Daerah Dr. Haryoto Kabupaten Lumajang","  Jl. Basuki Rahmat No.5, Lumajang",NA,NA,0,"kurang dari 1 menit",3,"kurang dari 1 menit","0334881666","35","3508",2021-08-08 18:42:56,"Non COVID-19"
"501","RS Wijaya Kusuma","Jl. A. Yani No.149 Lumajang",1,"11 jam",0,"11 jam",12,"11 jam","085236384331","35","3508",2021-08-08 18:42:56,"Non COVID-19"
"502","RS Djatiroto","Jl. PB. Sudirman 81  RT 03 RW 01, Dsn. Krajan Desa Kaliboto Lor Kec. Jatiroto, Kab. Lumajang",5,"12 menit",6,"12 menit",NA,NA,"0334321004","35","3508",2021-08-08 18:42:56,"Non COVID-19"
"503","RS Islam Lumajang","Jl. Kyai Muksin nomor 19 Kelurahan Tompokersan Kec. Lumajang Kab. Lumajang",3,"6 jam",0,"6 jam",18,"6 jam","0334887999","35","3508",2021-08-08 18:42:56,"Non COVID-19"
"504","RS Umum Daerah Majalengka"," Jl. Kesehatan No.77 Majalengka",12,"kurang dari 1 menit",24,"kurang dari 1 menit",71,"kurang dari 1 menit","0233281043","32","3210",2021-08-08 18:42:58,"Non COVID-19"
"505","RS Umum Daerah Cideres","Jl. Raya Cideres - Kadipaten No. 180 Bojong Cideres Dawuan ",3,"2 menit",35,"2 menit",23,"2 menit","0233661003","32","3210",2021-08-08 18:42:58,"Non COVID-19"
"506","RS Bedah Budi Kasih","Jl. Raya Majalengka - Kadipaten Km.7 no 84",10,NA,12,NA,18,NA,"0233511522","32","3210",2021-08-08 18:42:58,"Non COVID-19"
"507","RS Ibu dan Anak Mitra Plumbon Majalengka","Jl. Raya Barat Pasar Prapatan No. 109 ",5,"12 jam",2,"12 jam",1,"12 jam","hotline tidak tersedia","32","3210",2021-08-08 18:42:58,"Non COVID-19"
"508","RS Bala Keselamatan Bokor","Jl. A.Yani 91 Turen , Kab.Malang",4,NA,18,NA,26,NA,"0341824002","35","3507",2021-08-08 18:42:59,"Non COVID-19"
"509","RS Jiwa Dr. Radjiman Wediodiningrat Lawang","Jl. A. Yani, Lawang, Malang, Jawa Timur ",7,"6 jam",46,"6 jam",75,"6 jam","0341426015","35","3507",2021-08-08 18:42:59,"Non COVID-19"
"510","RS Umum Daerah Kanjuruhan Kepanjen Kab. Malang","Jl. Panji No. 100 Kepanjen, Kab. Malang",7,NA,12,NA,67,NA,"0341395041","35","3507",2021-08-08 18:42:59,"Non COVID-19"
"511","RS Marsudi Waluyo","Jl. Raya Mondoroko Km. 09, RT 004 RW 003 Desa Purwoasri, Kec. Singosari, Kab. Malang",0,"12 jam",0,"12 jam",6,"12 jam","0341458974","35","3507",2021-08-08 18:42:59,"Non COVID-19"
"512","RS Umum Wava Husada ","Jl. Panglima Sudirman No. 99A, Dilem, Kec. Kepanjen, Kab. Malang",15,NA,14,NA,24,NA,"0341393000","35","3507",2021-08-08 18:42:59,"Non COVID-19"
"513","RS Siti Miriam","Jl. dr. Wahidin No.101, RT 002 RW. 001, Kel. Kalirejo, Kec. Lawang, Kab.Malang",0,"33 jam",3,"33 jam",27,"33 jam","081288088101","35","3507",2021-08-08 18:42:59,"Non COVID-19"
"514","RS Angkatan Udara dr. Mohammad Moenir","Jl. Dr. M. Munir No.18 Lanud Abd. Saleh, Desa Saptorenggo Kec. Pakis Kab, Malang",5,"10 jam",10,"10 jam",11,"10 jam","0341792273","35","3507",2021-08-08 18:42:59,"Non COVID-19"
"515","RS Umum Wajak Husada","Jl. Raya Kidangbang RT. 16 RW. 05 Desa Kidangbang Kec. Wajak Kab. Malang 65173",1,"34 jam",8,"34 jam",5,"34 jam","hotline tidak tersedia","35","3507",2021-08-08 18:42:59,"Non COVID-19"
"516","RS Sumber Sentosa","Jl. Kebonsari No. 221 Malang, RT 003, RW 002 Desa Tumpang, Kec. Tumpang, Kab. Malang",1,NA,2,NA,27,"41 jam","0341787233","35","3507",2021-08-08 18:42:59,"Non COVID-19"
"517","RS Bedah Hasta Husada","Jl. Bromo 98-100 RT 011 RW 005, Kel. Kepanjen, Kec. Kepanjen, Kab. Malang",0,"37 jam",2,"37 jam",3,"37 jam","0341399499","35","3507",2021-08-08 18:42:59,"Non COVID-19"
"518","RS Umum Daerah Komodo","Desa Golo Bilas, Kecamatan Komodo, Kabupaten Manggarai Barat, NTT",1,NA,1,NA,13,NA,"081237312165","53","5315",2021-08-08 18:43:02,"Non COVID-19"
"519","RS Umum Daerah Manokwari","Jl. Bhayangkara No. 1 Manokwari",4,"22 jam",NA,NA,NA,NA,"081240368070","91","9105",2021-08-08 18:43:02,"Non COVID-19"
"520","RS Umum Daerah Kabupaten Melawi","Jl. Kelakik KM. 4 Nanga Pinoh Kabupaten Melawi",NA,NA,4,"41 jam",NA,NA,"082157766816","61","6110",2021-08-08 18:43:03,"Non COVID-19"
"521","RS Umum Citra Husada Nanga Pinoh","Jln. Dharma Bakti No. 45 C Nanga Pinoh",0,"34 jam",3,"34 jam",14,"34 jam","hotline tidak tersedia","61","6110",2021-08-08 18:43:03,"Non COVID-19"
"522","RS Umum Kasih Bunda Jaya Nanga Pinoh","Jl. Juang KM 2 Desa Tanjung Niaga Kecamatan Nanga Pinoh",5,NA,4,NA,3,NA,"hotline tidak tersedia","61","6110",2021-08-08 18:43:03,"Non COVID-19"
"523","RS Umum Daerah Kolonel Abundjani/Bangko","Jl. Kesehatan No.20, Bangko",14,"12 jam",14,"12 jam",35,"12 jam","07462145921118","15","1502",2021-08-08 18:43:03,"Non COVID-19"
"524","RS Raudhah","Jl Lintas Sumatera Km 1 Bukit Aur Bangko Jambi",12,NA,10,"41 jam",14,"41 jam","085210917729","15","1502",2021-08-08 18:43:03,"Non COVID-19"
"525","RS Umum Puri Husadatama","desa Simpang Pematang kecamatan Simpang Pematang",2,NA,3,NA,8,NA,"07267758104","18","1811",2021-08-08 18:43:03,"Non COVID-19"
"526","RS Siloam GMIM Sonder","Kolongan Atas, Sonder",6,"35 jam",16,"35 jam",4,"35 jam","0431356673","71","7102",2021-08-08 18:43:04,"Non COVID-19"
"527","RS Umum Daerah Mitra Sehat","Jl. Raya Ratahan - Liwutung Desa Towuntu Timur Kec. Pasan Kabupaten Minahasa Tenggara",NA,NA,NA,NA,34,"8 jam","082290584215","71","7109",2021-08-08 18:43:04,"Non COVID-19"
"528","RSU Ratatotok Buyat","   JL. J.W. Lasut Ratatotok II Kecamatan Ratatotok",9,"2 jam",11,"2 jam",35,"2 jam","085395560706","71","7109",2021-08-08 18:43:04,"Non COVID-19"
"529","RS Umum Sumberglagah Mojokerto"," Dsn. Sumberglagah Ds. Tanjungkenongo Kec. Pacet Mojokerto",5,"36 jam",14,"36 jam",35,"36 jam","0321690441","35","3516",2021-08-08 18:43:04,"Non COVID-19"
"530","RS Mutiara Hati Mojokerto","Jl. Raya Kemantren Wetan No.49, Desa Terusan, Kecamatan Gedeg, Kab. Mojokerto",5,"34 jam",5,"34 jam",4,"34 jam","0321363442","35","3516",2021-08-08 18:43:04,"Non COVID-19"
"531","RS Umum Daerah dr. H. M. Rabain Muara Enim","Jl. Sultan Mahmud Badarudin II No. 49",NA,NA,8,"40 jam",32,"40 jam","0734424345","16","1603",2021-08-08 18:43:05,"Non COVID-19"
"532","RS Ibu dan Anak Karunia Indah Medika","Jl. Mayor Tjik Agus Kiemas Lintas Kepur Muara Enim",2,"10 jam",NA,NA,NA,NA,"081273373378","16","1603",2021-08-08 18:43:05,"Non COVID-19"
"533","RS Umum Daerah Ahmad Ripin","Jl. Lintas Timur Komp. Perkantoran Bukit Cinto Kenang",10,"33 jam",31,"33 jam",32,"33 jam","0741590056","15","1505",2021-08-08 18:43:05,"Non COVID-19"
"534","RS Umum Daerah Sungai Gelam","Jl. Ketaling KM. 21 Sungai Gelam",NA,NA,4,"34 jam",45,"34 jam","082388203192","15","1505",2021-08-08 18:43:05,"Non COVID-19"
"535","RS Ibu dan Anak AL-Barra","Jl. Pulai Berantai Desa Ujung Padang Kecamatan Kota Mukomuko",5,NA,6,NA,3,NA,"085279031935","17","1706",2021-08-08 18:43:06,"Non COVID-19"
"536","RS Umum Daerah Raha","Jl. Ahmad yani raha no 10 Raha",7,"31 jam",17,"31 jam",49,"31 jam","082394440965","74","7402",2021-08-08 18:43:06,"Non COVID-19"
"537","RS Umum Daerah Puruk Cahu","Jl. A. Yani No. 497, Puruk Cahu",6,"31 jam",12,"31 jam",32,"31 jam","052831787","62","6213",2021-08-08 18:43:06,"Non COVID-19"
"538","RS Umum Daerah Sekayu","Jl. Kol. Wahid Udin Lingkungan I Kel. Kayuara Kec. Sekayu Kab.Musi Banyuasin",18,"9 jam",25,NA,45,NA,"07143330203","16","1606",2021-08-08 18:43:06,"Non COVID-19"
"539","RS Umum Daerah Sungai Lilin","Jl. Palembang-Jambi Km.117 Kecamatan Sungai Lilin",NA,NA,NA,NA,31,"9 jam","08127273339","16","1606",2021-08-08 18:43:06,"Non COVID-19"
"540","RS Umum Daerah Dr. Sobirin Kabupaten Musi Rawas","Jl. Yos Sudarso No. 13 Kelurahan Pasar Pemiri Kecamatan Lubuklinggau Barat II",3,"7 jam",5,"7 jam",11,"7 jam","0733321995","16","1605",2021-08-08 18:43:06,"Non COVID-19"
"541","RS Umum Daerah Nganjuk","Jl. Dr. Sutomo 62, Nganjuk",1,"31 jam",0,"31 jam",35,"31 jam","0358321818","35","3518",2021-08-08 18:43:08,"Non COVID-19"
"542","RS Umum Daerah Kertosono","Jl. Panglima Sudirman No.16 Kertosono.",28,"24 jam",40,"24 jam",113,"24 jam","03585501503","35","3518",2021-08-08 18:43:08,"Non COVID-19"
"543","RS Umum Bhayangkara Tk. III Nganjuk","Jl. Abdul Rahman Saleh 56, Kauman, Kabupaten Nganjuk",0,NA,0,NA,0,NA,"0358321896","35","3518",2021-08-08 18:43:08,"Non COVID-19"
"544","RS Islam Aisyiyah Nganjuk","Jl. Imam Bonjol No. 20 Nganjuk",3,"9 jam",8,"9 jam",3,"9 jam","0358324024","35","3518",2021-08-08 18:43:08,"Non COVID-19"
"545","RS Umum Widodo","Jl. Yos Sudarso 8 Ngawi",31,"35 jam",27,NA,24,"35 jam","0351746777","35","3521",2021-08-08 18:43:08,"Non COVID-19"
"546","RS Umum Daerah Dr. Ibnu Sutowo Baturaja","Jl. Dr. Moh.Hatta No.1,Baturaja",23,"30 jam",33,"30 jam",71,"30 jam","0735320298","16","1601",2021-08-08 18:43:09,"Non COVID-19"
"547","RS Umum Daerah Martapura","Jl. Adiwiyata Simpang Lengot Kota Baru Kecamatan Martapura",7,"35 jam",13,NA,23,"35 jam","07354840084","16","1609",2021-08-08 18:43:10,"Non COVID-19"
"548","RS Islam At-Taqwa Gumawang","Jl.Inspeksi Irigasi Komering, Tanah Merah, Kec. Belitang Madang Raya",8,"30 jam",14,"30 jam",13,"30 jam","085379648888","16","1609",2021-08-08 18:43:10,"Non COVID-19"
"549","RS Umum Panti Bhaktiningsih","Tegalrejo Belitang Kab. OKU Timur",8,"35 jam",18,"34 jam",27,"35 jam","0735450066","16","1609",2021-08-08 18:43:10,"Non COVID-19"
"550","RS Umum Daerah Ogan Komering Ulu Timur","Jl. Raya Belitang Rasuan No.1 Tulus Ayu Kecamatan Belitang Madang Raya",10,"33 jam",21,"33 jam",54,"33 jam","0735451815","16","1609",2021-08-08 18:43:10,"Non COVID-19"
"551","RS Umum Daerah  dr. Darsono","Jl. Ahmad Yani 51 Pacitan",NA,NA,NA,NA,12,NA,"0357881410","35","3501",2021-08-08 18:43:10,"Non COVID-19"
"552","RSU Agung Mulia","Jl. Sasuit Tubun Lingk. Bleber Kel. Sidoharjo Kec. Pacitan Kab. Pacitan",2,"32 jam",1,"32 jam",14,"32 jam","0357884466","35","3501",2021-08-08 18:43:10,"Non COVID-19"
"553","RS Umum Medical Mandiri Pacitan","Jl. Suruhan Sirnoboyo Kec. Pacitan Kab. Pacitan Jawa Timur",0,"12 jam",2,NA,24,NA,"0357883989","35","3501",2021-08-08 18:43:10,"Non COVID-19"
"554","RS Umum Mohammad Noer Pamekasan","JL. Bonorogo 17 Pamekasan Madura",NA,NA,3,NA,11,NA,"0324322594","35","3528",2021-08-08 18:43:11,"Non COVID-19"
"555","RS Alinda Husada","Jl. Raya Tanjung Lesung KM. 1 Panimbang",2,NA,3,NA,4,NA,"087772714887","36","3601",2021-08-08 18:43:11,"Non COVID-19"
"556","RS Umum Daerah Pandega Pangandaran","Jl. Merdeka Desa Pananjung Kec.Pangandaran Kab. Pangandaran",NA,NA,NA,NA,NA,NA,"02657503045","32","3218",2021-08-08 18:43:11,"Non COVID-19"
"557","RS AU dr. Dody Sardjoto","Jl. By Pass Bandar Udara Internasional Sultan Hasanuddin ",10,NA,20,NA,12,"12 jam","4118954384","73","7309",2021-08-08 18:43:11,"Non COVID-19"
"558","RS Umum Daerah Buluye Napoae Moutong","Jl. H. Samsurizal Tombolotutu No.1 Salumpengut Kec. Moutong",NA,NA,36,"34 jam",NA,NA,"082252662608","72","7208",2021-08-08 18:43:12,"Non COVID-19"
"559","RS Prima Husada","Jl. Raya Surabaya Malang KM 54 Lemahbang Kecamatan Sukorejo",30,"16 jam",28,"16 jam",11,"16 jam","03436745000","35","3514",2021-08-08 18:43:12,"Non COVID-19"
"560","RS Umum Daerah RAA Soewondo"," Jl. Dr Soesanto  No. 114",14,NA,26,"2 menit",84,"2 menit","082295005505 ","33","3318",2021-08-08 18:43:13,"Non COVID-19"
"561","RS Umum Islam Pati","Jl. Raya Pati-Tayu KM.18Waturoyo Margoyoso Pati",2,"12 menit",15,"12 menit",26,"13 menit","0295452316","33","3318",2021-08-08 18:43:13,"Non COVID-19"
"562","RS Umum Daerah Kayen Pati","Jl. Rumah Sakit No.1 Kayen Pati",9,"12 menit",5,"12 menit",22,"12 menit","02955503662","33","3318",2021-08-08 18:43:13,"Non COVID-19"
"563","RS Umum Keluarga Sehat "," Jl. P. Sudirman No. 9 Margorejo Pati",1,NA,0,NA,24,NA,"0295386111","33","3318",2021-08-08 18:43:13,"Non COVID-19"
"564","RS Umum As-Suyuthiyyah ","Jl. Raya Juwana - Tayu Km. 7 Guyangan Trangkil Pati Jawa Tengah ",3,"17 jam",10,"17 jam",12,"17 jam","085226000210","33","3318",2021-08-08 18:43:13,"Non COVID-19"
"565","RS Umum Daerah Kraton Kab. Pekalongan","  Jl. Veteran 31,Pekalongan",2,"42 menit",2,"42 menit",4,"42 menit","0285421621","33","3326",2021-08-08 18:43:13,"Non COVID-19"
"566","RS Umum Islam PKU Muhammadiyah Pekajangan","Jl. Raya Ambokembang No.42-44,Pekalongan",26,"6 menit",5,"6 menit",35,"6 menit","0285785133","33","3326",2021-08-08 18:43:13,"Non COVID-19"
"567","RS Umum Daerah Kajen Kab. Pekalongan","Jl. Raya Karangsari Karanganyar Kab. Pekalongan",11,NA,4,NA,80,"kurang dari 1 menit","081229355569","33","3326",2021-08-08 18:43:13,"Non COVID-19"
"568","RS Ibu dan Anak Aisyiyah Pekajangan Pekalongan","Jl. Raya Pekajangan No. 610",11,"42 menit",7,"42 menit",11,"42 menit","0285785909","33","3326",2021-08-08 18:43:13,"Non COVID-19"
"569","RS Umum  Efarina","Jl Lintas Timur No.1 Pangkalan Kerinci Riau",15,"16 jam",36,NA,11,"16 jam","0761494500","14","1404",2021-08-08 18:43:13,"Non COVID-19"
"570","RS Umum  Amalia Medika","Jl Lintas Timur Pangkalan Kerinci - Pelalawan - Riau",12,NA,6,NA,15,NA,"hotline tidak tersedia","14","1404",2021-08-08 18:43:13,"Non COVID-19"
"571","RS Umum Daerah Dr. M. Ashari Pemalang"," Jl. Gatot Subroto No.41,Pemalang",18,"57 menit",20,"57 menit",16,"57 menit","0284321614","33","3327",2021-08-08 18:43:14,"Non COVID-19"
"572","RS Umum Daerah Ratu Aji Putri Botung","Jl Propinsi KM 9 Kab. Penajam Paser Utara",NA,NA,NA,NA,36,"8 jam","082148580265","64","6409",2021-08-08 18:43:14,"Non COVID-19"
"573","RS Umum Daerah Talang Ubi","Jl. Lingkar Handayani Kel. Handayani Mulia Kec. Talang Ubi",1,"34 jam",2,"34 jam",17,"34 jam","0713390566","16","1612",2021-08-08 18:43:14,"Non COVID-19"
"574","RS Umum Daerah Pesawaran","Jln. Raya Kedondong, Sukamarga, Desa Gedong Tataan Kec. Gedong Tataan, kab. Pesawaran",8,"8 jam",15,"8 jam",65,"8 jam","07215621977 ","18","1809",2021-08-08 18:43:14,"Non COVID-19"
"575","RS Umum Daerah KH. Muhammad Thohir KRUI","Atar Sedangkek Pekon Way Suluh Kec. Krui Selatan Kab. Pesisir Barat",NA,NA,NA,NA,18,"11 jam","082372298787","18","1813",2021-08-08 18:43:14,"Non COVID-19"
"576","RS Umum Daerah Pidie Jaya","      Jl. Banda - Aceh KM. 158, Meureudu",2,NA,2,NA,34,"34 jam","08126911436","11","1118",2021-08-08 18:43:15,"Non COVID-19"
"577","RS Umum Daerah Lasinrang Pinrang","  Jl. Macan No. 22 Pinrang",NA,NA,NA,NA,7,"3 menit","0421921298","73","7315",2021-08-08 18:43:15,"Non COVID-19"
"578","RS Umum Aisyiyah Ponorogo","Jl. Dr Sutomo 18 - 24, Ponorogo",5,NA,29,NA,8,NA,"0352461560","35","3502",2021-08-08 18:43:15,"Non COVID-19"
"579","RS Umum Muhammadiyah Ponorogo","Jl. Diponegoro No. 50 Ponorogo",7,NA,22,NA,29,NA,"0352485928","35","3502",2021-08-08 18:43:15,"Non COVID-19"
"580","RS Umum Muslimat Ponorogo","Jl. Jend. A. Yani 155, Ponorogo",6,"43 menit",15,"43 menit",24,"43 menit","0352481986","35","3502",2021-08-08 18:43:15,"Non COVID-19"
"581","RS Umum Daerah Poso","Jl. Jenderal Sudirman No.33  Kel Kasintuwu Poso",8,"33 jam",NA,NA,NA,NA,"0811455179","72","7204",2021-08-08 18:43:16,"Non COVID-19"
"582","RS Umum Mitra Husada","Jl. Jend.A.Yani No.14 Pringsewu,Kab.Pringsewu",2,"11 jam",15,"11 jam",63,NA,"081279036111","18","1810",2021-08-08 18:43:16,"Non COVID-19"
"583","RS Umum Daerah Pringsewu","Jl. Lintas Barat Pekon Fajar Agung Barat Kec. Pringsewu",5,"34 jam",2,"34 jam",81,"34 jam","072923582","18","1810",2021-08-08 18:43:16,"Non COVID-19"
"584","RS Umum Surya Asih","Jl. A. Yani No.51, Pringsewu",11,NA,16,NA,11,NA,"085273345287","18","1810",2021-08-08 18:43:16,"Non COVID-19"
"585","RS Ibu dan Anak Harapan Bunda","Jl. KH. Dewantara No. 1269 Primgsewu - Lampung",3,"33 jam",5,"33 jam",1,"33 jam","072923186","18","1810",2021-08-08 18:43:16,"Non COVID-19"
"586","RS Umum Daerah Waluyo Jati Kraksaan","Jl. Dr. Soetomo No. 1 Kec. Kraksaan Kab. Probolinggo",13,NA,22,NA,47,NA,"0335841118","35","3513",2021-08-08 18:43:16,"Non COVID-19"
"587","RS Umum Daerah Pulang Pisau","Jl. W.A.D Duha Komplek Perkantoran Kab. Pulang Pisau  Provinsi Kalimantan Tengah",7,"7 jam",10,"7 jam",29,"7 jam","085245749601","62","6210",2021-08-08 18:43:16,"Non COVID-19"
"588","RS Umum Harapan Ibu","Jl. May.Jend.Soengkono KM.1,Kec. Kalimanah, Purbalingga dan JL. Soekarno Hatta No.02 Kec. Kalimanah ",4,"37 jam",20,"37 jam",28,"37 jam","0281892222","33","3303",2021-08-08 18:43:17,"Non COVID-19"
"589","RS Umum Daerah Panti Nugroho","Jl. Soekarno Hatta KM 2, Karang Manyar, Kalimanah, Purbalingga",4,"7 jam",15,"9 jam",22,"9 jam","02818901558","33","3303",2021-08-08 18:43:17,"Non COVID-19"
"590","RS Ibu dan Anak Ummu Hani","Jl. D I Panjaitan No 40 A Purbalingga Jawa Tengah",14,NA,15,NA,32,NA,"0281891373","33","3303",2021-08-08 18:43:17,"Non COVID-19"
"591","RS Umum Daerah Bayu Asih","Jl. Veteran No. 39 Purwakarta",0,NA,16,NA,1,"kurang dari 1 menit","0264200100","32","3214",2021-08-08 18:43:17,"Non COVID-19"
"592","RS Umum Siloam Purwakarta","Jl. Bungursari No.1, Purwakarta",6,"11 jam",14,"11 jam",9,"11 jam","02648628911","32","3214",2021-08-08 18:43:17,"Non COVID-19"
"593","RS Umum Asri Purwakarta","Jl. Veteran No. 15",5,"34 jam",12,"34 jam",13,"34 jam","0264211680","32","3214",2021-08-08 18:43:17,"Non COVID-19"
"594","RS Umum Rama Hadi","Kp. Cimaung RT 17/04 Desa Ciwangi Kec. Bungursari Kab. Purwakarta",14,"35 jam",13,"35 jam",6,"35 jam","0264202136","32","3214",2021-08-08 18:43:17,"Non COVID-19"
"595","RS Ibu dan Anak Dian","Jl. Raya Cibogo Hilir Kec. Plered Kab. Purwakarta",2,"12 jam",1,"12 jam",8,"12 jam","087812653989","32","3214",2021-08-08 18:43:17,"Non COVID-19"
"596","RS Umum Holistic Purwakarta","Jl. Terusan Kapten Halim KM.09 Salamulya, Pondoksalam, Purwakarta",0,"10 jam",0,"10 jam",4,"10 jam","0817225165","32","3214",2021-08-08 18:43:17,"Non COVID-19"
"597","RS Umum Bhakti Husada II Purwakarta","Jl. Raya Sadang-Subang KM 5 RT 01/01 Cikumpay Campaka Purwakarta",2,"13 jam",17,"13 jam",39,"13 jam","02648225255","32","3214",2021-08-08 18:43:17,"Non COVID-19"
"598","RS Umum Karina Medika","JL Baru Kp. Krajan RT 01 RW 01 Kec. Babakancikao Kab. Purwakarta 41151",7,"12 jam",28,"12 jam",7,"12 jam","0264 8301768","32","3214",2021-08-08 18:43:17,"Non COVID-19"
"599","RS Ibu dan Anak Bunda Fathia","Jl. Ibrahim Singadilaga No. 95-97 Purwakarta",NA,NA,NA,NA,3,"9 jam","02648309596","32","3214",2021-08-08 18:43:17,"Non COVID-19"
"600","RS Umum Panti Waluyo Yakkum Purworejo","Jl. Ahmad Yani No. 21 Purworejo",NA,NA,12,"35 jam",18,"35 jam","0275322094","33","3306",2021-08-08 18:43:17,"Non COVID-19"
"601","RS Ibu dan Anak Permata","jl. Mayjend Sutoyo No. 75 Rt 05 Rw 05",1,NA,3,NA,5,NA,"hotline tidak tersedia","33","3306",2021-08-08 18:43:17,"Non COVID-19"
"602","RS Umum Daerah Curup","Jl. Dua Jalur Kab. Rejang Lebong",17,"10 jam",23,"10 jam",43,"10 jam","082175999247","17","1702",2021-08-08 18:43:18,"Non COVID-19"
"603","RS An-Nissa","Jl. Lintas Curup Lubuk Linggau Kel. Simpang Nangka Kec. Selupu Rejang",5,NA,9,NA,13,NA,"085896515156","17","1702",2021-08-08 18:43:18,"Non COVID-19"
"604","RS Umum Daerah Sambas","Jl. Pendidikan no 300 Kecamatan Sambas",2,"43 menit",20,"43 menit",43,"43 menit","0562391020","61","6101",2021-08-08 18:43:19,"Non COVID-19"
